Start Time,End Time,English,Venom.The.Last.Dance.2024.BluRay.Film2Media.srt,Venom_The_Last_Dance_open subtitle.srt
28:12,28:13,<i>I'm detecting passive aggression.</i>,<i>دارم پرخاشگری غیرمستقیمی رو شناسایی می‌کنم</i>,زانوها رو خم کن
28:13,28:14,- Are you? <i>- Yeah.</i>,جدنی؟ - <i>آره -</i>,مرکز بدنت رو فعال کن
28:14,28:17,"Oh, I'm sorry. How about some <i>active</i> aggression?",عه شرمنده. یکم پرخاشگری فعال چطوره؟,آره دقیقا همینه
28:17,28:20,You just threw me off a 757,تو همین الان زدی از ...هواپیمای بوئینگ 757 پرتم دادی رفت,آره دقیقا همینه
28:20,28:22,without even the slightest consideration,<i>بی‌اینکه تو بگو اصلا سر سوزنی ملاحظه‌ی...</i>,اوو
28:22,28:24,for my chronic vertigo.,سرگیجه مزمن منو داشته باشی,ترسناک بود
28:24,28:26,It was an Airbus A320.,<i>یه هواپیمای اِیرباس اِی320 بود</i>,ترسناک بود
28:26,28:29,Was it? I am sorry. All right.,این بود؟ ببخش ما رو,این نیویورک نیست
28:30,28:31,And what was that thing?,...و اون چیزه چی بودش دیگه,یه حالت تهاجمی غیرفعال ازت حس می‌کنم
28:32,28:34,That thing that we just juiced back there?,اون چیزه که همین الان زدیم آبمیوه‌شو درآوردیم؟,یه حالت تهاجمی غیرفعال ازت حس می‌کنم
28:34,28:35,You're not going to like this.,<i>قرار نیست با این قضیه حال کنی</i>,یه کم تهاجم فعال چطور ؟
28:35,28:38,"No, I can absolutely guarantee you that I'm not gonna.",نه، برات می‌نویسم و امضا می‌کنم که .قرار هم نیست,تو منو از هواپیما پرت کردی پایین
28:40,28:42,What are you doing? Why are you doing that?,چیکار می‌کنی؟ چرا همچین می‌کنی؟,اونم در حالی که من اینقدر سرم گیج میره
28:42,28:44,That's er... You're being weird. That's creepy.,...این داری عجیب‌بازی درمیاری,اونم در حالی که من اینقدر سرم گیج میره
28:44,28:46,That was a Xenophage.,اون یه بیگانه‌خوار بود,بود  A320 اون ایرباس
28:46,28:47,A what?,یه چه؟ - یه بیگانه‌خوار -,آره؟ متاسفم
28:47,28:48,A Xenophage.,یه چه؟ - یه بیگانه‌خوار -,هورا
28:48,28:50,- A symbiote hunter. - Of course.,یه شکارچیِ سیمبیوت - بله دیگه -,اون چی بود؟
28:51,28:53,"Problem is, if she has found her way here,",<i>بدبختی اینه که</i> <i>،اگه اون زن راهشو به اینجا پیدا کرده</i>,اون چیزی که الان زدیم چی بود؟
28:53,28:55,others will soon follow.,بقیه هم بزودی دنباله‌رو میشن,خب این همین‌جوری قراره باشه
28:55,28:56,"""Others""?",بقیه؟,نه اینو کاملا تضمین می‌کنم
28:56,29:00,The Xenophage's maker also created us symbiotes.,سازنده بیگانه‌خوارها ما رو هم خلق کرده,داری چیکار می‌کنی؟
29:00,29:02,So that's your sister?,پس اوشون خواهرتن,چرا اینکارو می‌کنی؟
29:02,29:05,"All the symbiotes turned on him, locked him up on Klyntar.",،همه سیمیبیوت‌ها از خالقمون رو برگردوندن,اون یه زینوفیج بود
29:05,29:06,- Your planet. - No!,سیاره‌ت,یه زینوفیج
29:06,29:08,- Not a planet. - Not your planet.,نه، سیاره نیستش - سیاره‌ت نیست -,یه زینوفیج
29:08,29:10,A prison we built for him to sleep...,یه زندانه که ما براش ساختیم ...که بخوابه,یه همزیست کن‌تلا
29:10,29:12,- Of course. - ...for eternity!,مشخصه - اونم تا ابدیت... -,مشکل اینه که اگه راهشو اینجا پیدا کرده باشه بقیه‌شونم به زودی دنبالش میان
29:13,29:14,"What's his name, then?",اسمش چیه، اونوقت؟,مشکل اینه که اگه راهشو اینجا پیدا کرده باشه بقیه‌شونم به زودی دنبالش میان
29:15,29:17,I didn't hear a word you said.,یه کلمه از حرفتم نشنیدم,سازنده‌ زینوفیج یه همزیست دیگه هم ساخته
29:17,29:18,Knull.,نال - نال -,سازنده‌ زینوفیج یه همزیست دیگه هم ساخته
29:18,29:19,- Knull. - No!,نه,سازنده‌ زینوفیج یه همزیست دیگه هم ساخته
29:19,29:21,"Shush, shush, shush, shush.",نه,پس اون خواهر توئه
29:24,29:26,"This is serious, Eddie.",قضیه شوخی‌بردار نیست، ادی,نه سیاره‌ تو نیست
29:26,29:27,Let's just not talk.,بیا اصَن حرف نزنیم,سیاره‌ی تو نیست
29:29,29:30,Quiet.,ساکت,البته
29:35,29:38,"What does this Xyla-Xyn-Xyn-thingy,","،""این فلان چیزه ""بیخانه‌هار",نشنیدم چی گفت
29:38,29:40,"this symbiote hunter, want with you anyway?",،این شکارچی سیمبیوت حالا چی ازت می‌خواد؟,نه
29:40,29:43,It doesn't. It wants us. We have something it needs.,منو نمی‌خواد. اون ما رو می‌خواد,این جدیه ادی
29:44,29:48,"We only have this shitty shirt, we got one boot and sunburn.",یه چکمه و یه آفتاب سوختگی هم صاحبیم,این جدیه ادی
29:48,29:50,And the codex.,و کُدِکس,ساکت
29:50,29:51,"The what, now?",چه عرض کردی؟,
29:51,29:53,I'll show you.,نشونت میدمش,
29:54,29:56,"Damn it, what are you doing?",لعنت بابا، چیکار می‌کنی؟,این چیه ایزیلوم؟
29:56,30:00,<i>Let's say you died. I could bring you back to life.</i>,<i>بیا فرض کنیم تو مُردی</i>,این چیز ذن‌طور سیمبیوته چی می‌خواد ازت اصلاً؟
30:00,30:01,"<i>Well, I like that.</i>",<i>خب، با این خوش می‌کنم</i>,ما رو می‌خواد
30:01,30:04,"<i>But if I did, our separate life forces</i>",<i>،ولی اگه می‌کردم</i> <i>،نیروی حیات جداگونه‌مون</i>,ما یه چیزی داریم
30:04,30:09,<i>would become one single force called a codex.</i>,<i>به یه نیروی واحد به اسمِ</i>,یه رای داری
30:09,30:10,<i>What the hell is a codex?</i>,<i>کدکس دیگه چه سمیه؟</i>,حالا چی؟
30:11,30:15,<i>It's a key. A key that unlocks a cage.</i>,<i>کلیدی برای باز کردن قفسی</i>,داری چیکار می‌کنی؟
30:15,30:16,<i>The prison on Klyntar.</i>,<i>زندانی در کِلینتار</i>,بذار بگم که تو مردی
30:17,30:18,<i>It would free our creator.</i>,<i>این کلید خالق‌مون رو آزاد میکنه</i>,می‌تونم زنده‌ات کنم
30:19,30:20,"Well, thank God we haven't died.",خب، خدا رو شکرت که ما نمردیم,خب از اون خوشم میاد
30:20,30:22,"<i>Yeah, except that one time.</i>",<i>آره، با فاکتور گرفتن اون یه بار</i>,ولی اگه این کارو کنم نیروی زندگیمون
30:25,30:27,"<i>Oh, no. No.</i>",<i>نه. نه</i>,یکی میشه و به یه نیروی واحد به اسم کدکس تبدیل می‌شه
30:27,30:29,<i>So you're telling me we're carrying this thing.</i>,<i>پس داری بهم میگی که ما اینو همرامون داریم</i>,کدکس دیگه چیه؟
30:29,30:31,<i>That's why the Xenophage is hunting us.</i>,<i>سر همینم بیگانه‌خوار داره شکارمون میکنه</i>,یه کلیده
30:32,30:33,<i>What do we do?</i>,<i>چیکار کنیم خب؟</i>,یه کلید که یه زندان رو باز می‌کنه
30:33,30:35,<i>She can only see the codex</i>,<i>اون فقط موقعی می‌تونه کدکس رو ببینه</i>,زندانِ کلینتر
30:35,30:38,<i>when a symbiote is in its full true form.</i>,<i>که یه سیمبیوت تو شکل کامل واقعیش باشه</i>,خالق‌مون رو آزاد می‌کنه
30:40,30:42,Right.,صحیح,آره به جز اون یه بار
30:42,30:43,You mean you can't come out?,منظورت اینه که نمی‌تونی بیرون بیای دیگه؟,اوه نه
30:43,30:46,I can do this. I can do this.,می‌تونم این کارَ رو کنم. می‌تونم این کارَ رو کنم,اوه نه
30:46,30:48,"But if I fully transform,",،ولی اگه کاملا تبدیل بشم,داری می‌گی که اینو حمل می‌کنیم؟
30:48,30:51,the codex sends her a tracking signal.,کدکس یه سیگنال ردیابی براش می‌فرسته,واسه همینه که اون انفج دنبالمونه
30:51,30:54,"She'll find us, rip it out of our spine",،اونم پیدامون میکنه ،از ستون فقراتمون می‌کَندش,اون فقط می‌تونه کدکسو ببینه وقتی که سیمبیوت تو فرم اصلیش باشه
30:54,30:56,and free Knull from Klyntar.,و نال رو از کِلینتار آزاد میکنه,اون فقط می‌تونه کدکسو ببینه وقتی که سیمبیوت تو فرم اصلیش باشه
30:56,30:57,So how do we get rid of this codex?,خب چجوری از شر این کدکس خلاص شیم؟,اون فقط می‌تونه کدکسو ببینه وقتی که سیمبیوت تو فرم اصلیش باشه
30:57,31:02,"As long as you and I both live, the codex exists.",،تا زمانی که من و تو زنده‌ایم کدکس هم وجود داره,منظورت اینه که نمی‌تونی بیای بیرون
31:02,31:04,- If one of us should die... - No.,...اگه یکی‌مون احیانا بمیره,می‌تونم این کارو کنم
31:04,31:05,...the codex would die.,نه - کدکس هم می‌میره... -,می‌تونم این کارو کنم
31:05,31:07,- That's not gonna work for me. - Nor me!,به کار من که نمیاد - و نه من -,ولی اگه کامل تغییر شکل بدم کدکس یه سیگنال ردیابی براش می‌فرسته
31:08,31:10,That Xenophage was fast.,اون بیگانه‌خواره خیلی فرز بود,ولی اگه کامل تغییر شکل بدم کدکس یه سیگنال ردیابی براش می‌فرسته
31:10,31:12,It won't take long for the feds to tie us,خیلی واسه فدرالی‌ها هم طول نمیکشه که ببندنمون به,پیدامون می‌کنه اونو از ستون فقراتمون می‌کشه بیرون و نال رو از کلینتر آزاد می‌کنه
31:12,31:15,to those four headless bodies we left in Mexico.,اون چهارتا جنازه‌ی بی‌کله‌ای که تو مکزیک به جا گذاشتیم,پیدامون می‌کنه اونو از ستون فقراتمون می‌کشه بیرون و نال رو از کلینتر آزاد می‌کنه
31:15,31:17,"- We gotta get out of here. - Yeah, we better go.",باید از اینجا گم بریم - آره، بهتره بریم -,پس چطوری از شر این کدکس خلاص شیم؟
31:23,31:25,<i>Four legs are better than one.</i>,<i>چهار تا پا بِه از یک پائه</i>,اگه یکی از ما بمیره کدکس هم می‌میره
31:25,31:27,"Be honest with me, buddy.",خودم و خودتیم دیگه، رفیق,اون به کار من نمیاد
31:28,31:31,How fast do you think you can get that thing to go?,به نظرت چقدر سریع می‌تونی ،اون چیزَ رو بُروش کنی,زیاد طول نمی‌کشه تا فدرالی ها ما رو
31:31,31:32,Without killing it.,بی‌اینکه بکشیش؟,با اون چهار تا جنازه بدون سر تو مکزیک ربط بدن
31:32,31:33,<i>Only one way to find out.</i>,<i>فقط یه راه واسه فهمیدنشه</i>,با اون چهار تا جنازه بدون سر تو مکزیک ربط بدن
31:35,31:38,<i>Don't scare him. Don't scare horsey-horsey-horse.</i>,<i>نترسونیش اسب اسبی بابا رو</i>,آره بهتره بریم
31:41,31:42,<i>Nice horsey.</i>,<i>چه اسب اسبی قشنگی</i>,چهار تا پا بهتر از یه دونه‌اس
31:42,31:43,Hey.,هی,چهار تا پا بهتر از یه دونه‌اس
31:44,31:45,<i>Nice horsey.</i>,<i>چه اسب اسبی قشنگی</i>,با من صادق باش رفیق
31:47,31:48,"<i>Surprise, horsey!</i>",<i>غافلگیری، اسب اسبی</i>,فکر می‌کنی چقدر می‌تونی این وسیله رو بدون کشتنش سریع کنی؟
31:50,31:51,<i>I love horsey!</i>,<i>من عاشقِ اسب اسبی‌ام</i>,فکر می‌کنی چقدر می‌تونی این وسیله رو بدون کشتنش سریع کنی؟
31:59,32:01,Let's go.,بزن بریم,اسب خوشگله. هی
32:03,32:05,<i>Yeehaw!</i>,<i>پیتیکو</i>,اسب خوشگله هی
32:10,32:12,"<i>Ride me, cowboy!</i>",<i>سواری روم کن، گاوچرون</i>,
32:12,32:14,You are an asshole!,تو یه عوضی‌صفتی,
32:14,32:16,"I swear to God, when I get off this horse,",،به خدا قسم از این اسب که پیاده شم,
32:16,32:18,"I'm gonna kick your ass, you mother...",،یه سرویس‌کاری می‌کنمت ...ای مادر,
32:26,32:28,<i>Now that's horsepower!</i>,<i>الان اسب بخار که میگن اینه‌ها</i>,
32:43,32:44,<i>Safe haven?</i>,<i>پناهگاه امن؟</i>,
32:45,32:47,No. They're not here for a safe haven.,نه. اونا واسه یه پناهگاه امن اینجا نیستن,حالا این دیگه قدرت واقعیه
32:48,32:51,How about a new home? Evict the current tenants.,یه خونه جدید و بیرون انداختن مستاجرای فعلی چطور؟,
32:51,32:54,"I think you've watched too many alien invasion movies, Rex.",به نظرم تو دیگه زیادی فیلمای تهاجم فضایی‌ها رو تماشا کردی، رِکس,
32:57,32:58,Have I?,واقعا؟,
33:05,33:07,They were running. That's what he said.,اونا در حال فرار بودن این حرفیه که اون گفت,نه. برای پناهگاه امن اونا اینجا نیستن
33:07,33:09,Don't kid yourself.,بچه نباش,درباره‌ی یه خونه‌ی جدید برای مستأجرای فعلی  چی می‌گی ؟
33:09,33:10,They were always migrating.,اونا به دلخواه در حال مهاجرت بودن,درباره‌ی یه خونه‌ی جدید برای مستأجرای فعلی  چی می‌گی ؟
33:10,33:13,<i>A meteor carrying symbiote life</i>,<i>شهاب سنگی حامل حیات سیمبیوت</i>,فکر کنم خیلی فیلم‌های حمله بیگانه دیدی رکس
33:13,33:16,"<i>crashes on Earth, and they all survive.</i>",<i>،به زمین می‌خوره و همشون هم زنده می‌مونن</i>,مگه نه؟
33:16,33:17,<i>Coincidence?</i>,<i>اتفاقیه؟ ولم کن بابا</i>,مگه نه؟
33:17,33:18,<i>Give me a break.</i>,<i>اتفاقیه؟ ولم کن بابا</i>,
33:20,33:21,All right.,خیلی‌خب,
33:23,33:24,Let's go get 'em.,بریم بگیریمشون,اونا در حال فرار بودن .اینو گفت
33:25,33:27,You're so desperate to believe,تو در به در دنبال این باوری که,اونا همیشه در حال مهاجرت بودن
33:27,33:29,that they're here for altruistic reasons.,اونا برای دلایل خیرخواهانه اینجان,اونا همیشه در حال مهاجرت بودن
33:30,33:32,Makes you dangerous.,همینم خطرناکت میکنه,یه شهاب‌سنگ با زندگی سمبیوتی به زمین می‌خوره و همه‌شون زنده می‌مونن
33:42,33:44,We just intercepted an emergency call,همین الان تماس اضطراری‌ـه,بریم سراغشون
33:44,33:45,from an Airbus out of Mexico,یه هواپیمای اِیرباسِ بلند شده از مکزیک که میگه,تو خیلی ناامیدی که باور کنی اونا اینجا برای نیت‌های بشردوستانه‌ان
33:45,33:48,saying a man jumped off the plane over Sequoia.,مردی از هواپیما روی پارک ملی سِکویا پریده رو، شنود کردیم,تو خیلی ناامیدی که باور کنی اونا اینجا برای نیت‌های بشردوستانه‌ان
33:49,33:50,We'll take the Osprey.,"هواگرد ""عقاب ماهی‌گیر"" رو می‌بریم",این باعث میشه خطرناک بشی
33:50,33:52,"Eyes wide, Paine.",چهارچشمی حواست باشه، پِین,
34:02,34:03,I can't feel my balls.,تخمامو حس نمی‌کنم,ما یه تماس اضطراری از یه ایرباس توی مکزیک گرفتیم
34:07,34:08,That was horrible.,وحـ... وحشتناک بود,با اوسمور ما می‌ریم
34:24,34:26,<i>Visual on suspect.</i>,مظنون در دیده,
34:29,34:30,Take him out.,از پا درش‌بیارین,
34:30,34:34,- Collect the symbiote. <i>- Team Six engaged.</i>,و سیمبیوت رو بگیرین,
34:43,34:46,<i>Disengage harness. Let's go.</i>,<i>کمربند رو باز کنید. بریم</i>,
36:22,36:23,<i>No! The codex!</i>,نه! کدکس - نمی‌تونم بذارم بمیری -,
36:23,36:24,Can't let you die.,نه! کدکس - نمی‌تونم بذارم بمیری -,
36:44,36:46,Where did that come from?,این دیگه از کجا سبز شد؟,
36:59,37:00,<i>- Morph!</i> - Copy.,قالب عوض کن - تفهیم شد -,
37:09,37:10,<i>- Time to go!</i> - Hell yeah!,<i>وقت رفتنه -</i> آره قربونش -,
37:48,37:50,What happened?,چی شد؟,
37:50,37:51,<i>There's something else out here.</i>,<i>یه چیز دیگه‌ای هم اینجاست</i>,
37:51,37:53,- Something else? <i>- He said this would happen.</i>,یه چیز دیگه؟,
37:53,37:55,I just lost three people.,من همین الان سه نفرو از دست دادم,
37:55,37:57,Can you collect any samples?,می‌تونی هیچ نمونه‌ای جمع کنی؟,
37:58,38:00,Samples?,نمونه دیگه؟,
38:21,38:22,Those were not feds.,اونا فدرالی نبودن,
38:22,38:25,Those were some special forces shit.,اونا یه چندتایی نیروهای ویژه ریدمال بودن,
38:25,38:27,<i>- They were trying to kill us.</i> - Yeah.,قصد جونمون رو داشتن,
38:27,38:31,"Yeah, great. Great. So now we have the cops,",،پس الان پلیسا، ارتش ایالات متحده,
38:31,38:32,the United States Army,،پس الان پلیسا، ارتش ایالات متحده,
38:32,38:36,and some creature from hell hunting us.,و یه فلان موجودی از جهنم رو داریم... که دنبالمونن,
38:37,38:40,"Oh, God, I just saw blood mist spray",وای خدا، همین الان دیدم که افشانه خون,اونا فدرالی ها نبودن اونا نیروی ویژه بودن
38:40,38:42,out of the back of an alien's face.,از پشتِ سر و صورت یه فضایی می‌پاشید,اونا فدرالی ها نبودن اونا نیروی ویژه بودن
38:52,38:53,I killed someone.,من یکی رو کشتم,ارتش ایالات متحده و یه موجود از جهنم دنبالمونه
38:53,38:56,<i>They didn't give you a choice.</i>,<i>اونا برات حق انتخابی نذاشتن</i>,ارتش ایالات متحده و یه موجود از جهنم دنبالمونه
38:57,38:58,<i>You</i> didn't give me a choice.,تو برام حق انتخابی نذاشتی,آه خدایا تازه خون رو دیدم که از پشت صورت یه بیگانه می‌پاشه
38:59,39:00,<i>I couldn't get to you.</i>,<i>نتونستم بهت برسم -</i> تو اون تندآب رو نمیگم -,آه خدایا تازه خون رو دیدم که از پشت صورت یه بیگانه می‌پاشه
39:00,39:03,Not in the rapids. A year ago when you stole my life.,یه سال پیش، وقتی که زندگیمو دزدیدی رو میگم,آه خدایا تازه خون رو دیدم که از پشت صورت یه بیگانه می‌پاشه
39:03,39:05,<i>We've been together for a whole year?</i>,<i>ما شیرین یه ساله با همیم؟</i>,
39:05,39:07,A year too long. Just stay hidden,یه سالِ زیادی آزگار,
39:07,39:09,while we get to New York without getting killed.,برسیم به نیویورک,
39:20,39:22,We need you to come out.,می‌خوایم بیرون بیای,یک سال پیش زندگی منو دزدی
39:26,39:29,"The thing you talked about, the creature...",،اون چیزی که ازش حرف میزدی ...اون موجود,یک سال خیلی طولانی بود. فقط پنهان بمون تا ما بدون اینکه کشته بشیم به نیویورک برسیم
39:29,39:30,It's here.,اینجاست,
39:34,39:35,It killed some people.,چند نفری رو کشته,
39:59,40:00,Wow.,,
40:02,40:04,He's so beautiful.,چقدر زیبائه,
40:25,40:26,<i>I sense...</i>,<i>...نوع خودم</i>,
40:28,40:31,<i>I sense my own.</i>,<i>نوع خودم رو حس می‌کنم</i>,
40:37,40:39,"<i>And yet,</i>",<i>،با این وجود، اونی که نال در پِی‌ـش هست</i>,...من حس می‌کنم
40:39,40:44,<i>the one Knull seeks is not here.</i>,<i>،با این وجود، اونی که نال در پِی‌ـش هست</i>,
40:48,40:49,<i>What does he seek?</i>,اون در پِی چیه؟,انگار یه حس قدیمی داره بهم دست می‌ده
40:53,40:55,<i>The black one.</i>,<i>اون سیاه</i>,
40:55,40:56,<i>Brock's symbiote?</i>,سیمبیوتِ براک؟,و هنوز اون که نولسیک‌هاست اینجا نیست
40:57,41:00,He's the only one who carries a codex.,<i>اون یگانه کسی‌ـه که حامل کدکسه</i>,و هنوز اون که نولسیک‌هاست اینجا نیست
41:02,41:06,<i>The end is Knull.</i>,<i>آخر کار رو... نال رقم میزنه</i>,چی دنبالش هست؟
41:13,41:15,You need your suit.,لباست رو تنت لازم داری,ووکسیبیا؟
41:16,41:18,Still worried about giving this thing a cold?,هنوز دلهره داری که به این چیز سرماخوردگی بدم؟,اون تنها کسیه که کدکس رو داره
41:19,41:22,<i>Venom carries the key to Knull's freedom.</i>,<i>ونوم، کلید رهایی نال رو همراه داره</i>,...پایان
41:22,41:25,He must never obtain it.,<i>نال هرگز نباید حاصلش کنه</i>,حالا شروع میشه
41:25,41:26,<i>Or your race will be killed.</i>,وگرنه نسلتون کشته میشه,
41:28,41:29,<i>You.</i>,<i>.تو هم</i>,
41:30,41:32,And you.,<i>و تو</i>,
41:32,41:34,<i>And...</i>,<i>...و</i>,به لباس‌ت نیاز داری
41:34,41:36,you.,<i>تو</i>,هنوز نگران اینی که به این چیز سرما بزنیم؟
41:38,41:41,"<i>Everyone, everything.</i>",<i>هر کسی، هر چیزی</i>,ونوم کلید آزادی نولسه
41:41,41:44,<i>How do we stop whatever's up there from coming down here?</i>,چجوری جلوی هر فلان چی‌ای که اون بالاست رو از پایین اومدن به اینجا بگیریم؟,هرگز بهش نمی‌رسه
41:44,41:45,<i>You can't.</i>,<i>نمی‌تونین</i>,یا نژادت کشته میشه
41:46,41:49,<i>He's older than the universe.</i>,<i>اون از هستی قدیمی‌تره</i>,...و تو
41:49,41:52,He needs the key.,<i>اون، کلید رو احتیاج داره</i>,...و
41:52,41:57,<i>Then everything will end.</i>,<i>سپس همه‌چیز به آخر میرسه</i>,همه همه چیز
42:00,42:02,<i>How do we stop him from getting it?</i>,چجوری جلوشو بگیریم دستش بهش نرسه؟,چطور می‌تونیم از اومدن هرچی اونجا هست به اینجا جلوگیری کنیم؟
42:02,42:07,"<i>If the symbiote and the host are alive,</i>",<i>،اگه سیمبیوت و میزبان زنده باشن</i>,اون از کل عالم قدیمی‌تره
42:08,42:11,<i>then the codex is alive.</i>,<i>پس کدکس هم زنده‌ست</i>,منظورش کلیده
42:13,42:14,And if one of them dies?,و اگه یکی‌شون بمیره؟,اون وقت همه چیز تموم میشه
42:14,42:16,The codex dies.,<i>کدکس هم می‌میره</i>,اون وقت همه چیز تموم میشه
42:16,42:19,<i>The codex dies.</i>,<i>کدکس هم می‌میره</i>,چطور می‌تونیم از رسیدن اون بهش جلوگیری کنیم؟
42:20,42:23,"- Rex, you can't be serious. - Oh, I'm game.",رکس، جدی که نیستی تو - من که اومدم تو بازی -,اگه سمبیوت و میزبان زنده باشن
42:23,42:25,Destroying the codex is the only way,نابود کردن کدکس، تنها راهیه که,اگه سمبیوت و میزبان زنده باشن
42:25,42:27,it remains unobtainable. Right?,دست‌نیافتنی بمونه، درسته؟,اون وقت کدکس زنده‌ست
42:28,42:30,"<i>Hey, buddy, I'm talking to you.</i>",،هی رفیق جان با توئما,
42:30,42:31,Destroying it?,نابود کردنش؟,
42:31,42:33,We have barely even scratched the surface.,ما بزور حتی قطره‌ای از دریا رو دیدیم,و اگه یکی از اون‌ها بمیره؟
42:33,42:34,My people are dead.,افراد من مُردن,کدکس می‌میره؟
