Start Time,End Time,English,Venom.The.Last.Dance.2024.BluRay.Film2Media.srt,Venom_The_Last_Dance_open subtitle.srt
00:54,00:56,I am Knull.,من نال هستم,مترجم مستر مووی کانال تلگرام : @MRMOVIEHC
00:56,00:58,God of the void.,ایزد خلاء,مترجم مستر مووی کانال تلگرام : @MRMOVIEHC
00:58,01:00,Slicer of worlds.,پاره‌کننده‌ی دنیاها,مترجم مستر مووی کانال تلگرام : @MRMOVIEHC
01:00,01:03,"<i>Long ago,</i>",<i>،در دیرباز</i> <i>،آن هنگام که نور در قلمروی من تاخت و تاز به پا کرد</i>,
01:03,01:06,"<i>when light invaded my kingdom,</i>",<i>،در دیرباز</i> <i>،آن هنگام که نور در قلمروی من تاخت و تاز به پا کرد</i>,
01:06,01:09,<i>my symbiote children betrayed me</i>,"<i>فرزندان ""سیمبیوت""‌ من به من خیانت کرده</i> <font color=""#fdffae"" face=""Calibri""><b>نژادی از انگل‌های فرازمینی و بدون شکلِ تو کمیک‌های مارول) (ونوم هم یکیشونه</b></font>",
01:10,01:12,<i>and imprisoned me here.</i>,<i>و در اینجا محبوسم کردن</i>,
01:16,01:20,"At last, a codex has been created.",سرانجام، کُدِکس‌ـی پدید آمده,من خدای خلأ نیستم قاتل دنیاها
01:20,01:23,It is the key to my freedom.,این، کلیدی برای آزاد ساختن منه,زمانی که نور به قلمروم حمله کرد
01:23,01:26,It will unlock this prison.,قفل این زندان را می‌گشایه,زمانی که نور به قلمروم حمله کرد
01:27,01:31,I order you to search the corners of the universe,گوشه به گوشه هستی را گشته,بچه‌های همزیستم بهم خیانت کردن و منو اینجا زندونی کردن
01:31,01:34,until you find this key.,تا این کلید را بیابید,بچه‌های همزیستم بهم خیانت کردن و منو اینجا زندونی کردن
01:34,01:37,Find me the codex.,کدکس را برایم بیابید,بالاخره کدکس داره ساخته میشه
01:44,01:46,"And when I escape,",،و آن هنگام که بگریزم,این زندانو باز می‌کنه
01:46,01:48,and annihilate every living planet,و هر سیاره حیات‌دار را زِدوده کرده,دستور میدم همه گوشه‌های جهان رو بگردی تا این کلید رو پیدا کنی
01:49,01:53,"and destroy my symbiote offspring,",و سیمبیوت‌های زاده‌م را ،نابود سازم,دستور میدم همه گوشه‌های جهان رو بگردی تا این کلید رو پیدا کنی
01:53,01:55,I will reward you...,شما را با زندگانیتان پاداش خواهم داد,دستور میدم همه گوشه‌های جهان رو بگردی تا این کلید رو پیدا کنی
01:56,01:57,with your lives.,شما را با زندگانیتان پاداش خواهم داد,کدکس رو برام پیدا کن
02:33,02:35,"<i>So you're saying in this universe,</i>",<i>،تو این دنیا</i> <i>این آدمای ابرقهرمان در کارن</i>,
02:35,02:37,<i>there's these superhero people.</i>,<i>،تو این دنیا</i> <i>این آدمای ابرقهرمان در کارن</i>,
02:37,02:38,All right.,خیلی‌خب,
02:39,02:42,So tell me again about your purple alien friend,میگم باز راجب این رفیق فضایی بنفشتون,
02:42,02:44,who really loves stones.,که بدجور عشق سنگ داره برام تعریف کن,
02:45,02:47,"'Cause I'll tell you what, man,",،چون بذار بهت بگم داستان چجوریاست، مرد,
02:47,02:51,"aliens, they do not love stones.",،فضایی‌ها,
02:51,02:52,"<i>- Eddie, don't start.</i> - No.",<i>ادی، شروع نکن -</i> نه، نه -,
02:52,02:55,"No, they do not love stones.",اونا عشق سنگ ندارن,یعنی تو میگی توی این دنیا آدمای ابرقهرمان هستن
02:56,02:57,Do you know what they love?,می‌دونی اونا عشق چی دارن؟,یعنی تو میگی توی این دنیا آدمای ابرقهرمان هستن
02:58,03:00,They love eating brains!,اونا عشق مغزخوری دارن,خب دوباره بگو از اون رفیق بنفشت که عاشق سنگ‌هاست
03:00,03:02,Because that's what they do.,چون کارشون اینه,خب دوباره بگو از اون رفیق بنفشت که عاشق سنگ‌هاست
03:02,03:06,"<i>Señor,</i> he made my family disappear.",جناب، اون خونواده منو ناپدید کرد,خب دوباره بگو از اون رفیق بنفشت که عاشق سنگ‌هاست
03:06,03:07,For five years.,اونم پنج سال,ببین داداش فضایی‌ها عاشق سنگ نیستن
03:10,03:11,"Five years, huh?",خب، پنج سال، ها؟,ببین داداش فضایی‌ها عاشق سنگ نیستن
03:13,03:15,"Well, that is a long time.",خب، یه عمره,عاشق سنگ نیستن
03:16,03:17,All right.,خیلی‌خب,می‌دونی عاشق چی هستن؟
03:17,03:19,<i>Eddie!</i>,<i>ادی</i>,
03:19,03:21,<i>We are drunk!</i>,<i>ما مست شدیم</i>,عاشق مغز خوردنن چون کارشون همینه
03:34,03:36,<i>We're home!</i>,<i>اومدیم خونه</i>,ببین پنج سال خیلی زمانه
03:36,03:38,<i>I'm so done with the multi-verse shit.</i>,<i>دیگه از دست این ریدمال چندجهانی شدید چیزم دراومده</i>,باشه
03:38,03:40,<i>And I like our version of the barman better.</i>,<i>و با نسخه بارچی خودمون هم بیشتر حال می‌کنم</i>,ما مستیم
03:41,03:43,Ow. My head hurts.,سرم درد میکنه,ما مستیم
03:43,03:45,"I feel like I'm drunk,",حسِ مستی دارم,
03:45,03:47,but I'm also hungover at the same time.,ولی در آن واحد خمار هم هستم,
03:47,03:49,<i>Eddie! You want a Bloody María.</i>,<i>تو یه مشروب بِلادی مِری دواته</i>,
03:50,03:51,"<i>Oh, yeah!</i>",<i>آره بابا</i>,
03:55,03:57,- No. - I don't want a drink.,نه - من مشروب نمی‌خوام -,خونه‌ایم
04:00,04:03,Stop! You are destroying this man's bar!,بس کن! داری میخونه این مرد رو به ویرونه میکشونی,سرم درد می‌کنه
04:09,04:10,<i>Tequila!</i>,<i>تِکیلا</i>,یه بلادی مری میخوای ؟
04:11,04:13,"<i>I'm having the time of my life, Eddie!</i>",<i>یعنی دارم زندگی می‌کنما، ادی</i>,نمی‌خوام چیزی بخورم
04:14,04:16,I'd rather have a glass of water.,یه لیوان آب رو مقدم می‌شمارم,نمی‌خوام چیزی بخورم
04:16,04:17,"<i>Be a man, Eddie.</i>",<i>مردی گفتن بابا، ادی</i>,نمی‌خوام چیزی بخورم
04:19,04:22,<i>We should've been a bartender!</i>,<i>ما باید بارچی می‌شدیما</i>,داری بار این بنده خدا رو خراب می‌کنی
04:26,04:28,<i>- Tequila!</i> - I did it.,من تونستم - <i>منم که تونستم -</i>,
04:28,04:29,I <i>did it.</i>,من تونستم - <i>منم که تونستم -</i>,
04:31,04:34,What the hell were those things?,اونا دیگه آخه چه کوفتی بودن؟,امروز خیلی خوش می‌گذره
04:35,04:36,I was born with them.,مادرزاد باهاشونم,ترجیح می‌دم یه لیوان آب بخورم
04:38,04:41,Freaking bar! I'm done with this shit!,.این میخونه شیری تخیلی .دیگه نمیکشم این ریدمال رو,باید بارتندر می‌شدیم
04:43,04:46,<i>This is Kelly Roulet reporting from San Francisco.</i>,<i>از سان فرانسیسکو خبررسانی می‌کنم</i>,
04:46,04:49,<i>Police are still trying to locate</i>,"{\an8}<font face=""Segoe UI"" color=""#ffff00""><b>:فراری] [ادی براک</b></font>",من زدم
04:49,04:50,<i>former reporter Eddie Brock for questioning...</i>,<i>پلیس همچنان در تلاش برای یافتنِ خبرنگار سابق</i>,من زدم
04:50,04:52,"Oh, no.",<i>...ادی براک به هدف بازجویی</i> وای نه -,
04:52,04:55,<i>...after the tragic death of Detective Patrick Mulligan.</i>,<i>آن هم بعد از مرگ غم‌انگیزِ کارآگاه پاتریک مولیگان می‌باشد</i>,اون چیزا چی بودن؟
04:55,04:56,No.,نه,از اول با من بودن
04:56,04:58,<i>Detective Mulligan was found impaled</i>,<i>کارآگاه مولیگان در میانِ یک سری وقایع عجیب و نامانوس</i>,از اول با من بودن
04:58,05:01,<i>amidst a series of bizarre happenings</i>,<i>در کلیسای جامع شهر</i>,این بار لعنتی دیگه بسه
05:01,05:02,<i>at the city's cathedral.</i>,<i>فرو رفته در چوب، پیدا شد</i>,
05:02,05:04,They think that I killed him.,فکر میکنن من کشتمش,این گزارش کیلی روله از سانفرانسیسکو هست
05:04,05:06,<i>How long can he evade authorities?</i>,<i>تا کِی می‌تونه از دست مقامات گریزان باشه؟</i>,این گزارش کیلی روله از سانفرانسیسکو هست
05:06,05:08,<i>Only time will tell.</i>,<i>تنها زمان، مشخص خواهد کرد</i>,پلیس هنوز دنبال گزارشگر سابق ادی براک برای بازجویی‌ه
05:08,05:10,"<i>If we are on the news here,</i>",<i>،اگه ما تو اخبار اینجاییم</i>,پلیس هنوز دنبال گزارشگر سابق ادی براک برای بازجویی‌ه
05:10,05:13,<i>we are on the news everywhere.</i>,<i>تو اخبار هر جایی هستیم</i>,پلیس هنوز دنبال گزارشگر سابق ادی براک برای بازجویی‌ه
05:15,05:16,"Well, we can't go back to San Francisco.",خب، نمی‌تونیم برگردیم سانفرانسیسکو,بعد از مرگ غم‌انگیز کارآگاه پاتریک مالیگان
05:16,05:18,"And I'm not staying down here,",و من اینجا هم نمی‌مونمُ,کارآگاه مالیگان رو توی حالت بدی پیدا کردن و
05:18,05:21,"hiding for the rest of my life in Mexico, that's for sure.",تا عمر دارم تو مکزیک قایم باشم,یه سری اتفاقات عجیب توی کلیسای شهر افتاده
05:21,05:22,<i>Where will we go?</i>,<i>راهیِ کجاییم؟</i>,یه سری اتفاقات عجیب توی کلیسای شهر افتاده
05:22,05:24,I don't know. I don't know.,نمی‌دونم. نمی، نمی‌دونم,فکر می‌کنن من کشتمش
05:28,05:29,Ooh.,,اگه تو خبرای اینجاییم تو همه جا تو خبریم
05:30,05:32,That could work. Hey.,اومدیمو جواب داد. هی,اگه تو خبرای اینجاییم تو همه جا تو خبریم
05:32,05:33,This judge got me,یه قاضی‌ای منو از نیویورک شوت کرد بیرون,اگه تو خبرای اینجاییم تو همه جا تو خبریم
05:33,05:35,- kicked out of New York. <i>- What a dick!</i>,یه قاضی‌ای منو از نیویورک شوت کرد بیرون,نمی‌تونیم برگردیم سان‌فرانسیسکو و منم قصد ندارم باقی
05:35,05:38,"Yeah, I still got a ton of shit on him too.",من هنوزم یه کامیون آتو ازش دارم,نمی‌تونیم برگردیم سان‌فرانسیسکو و منم قصد ندارم باقی
05:38,05:41,<i>I've always wanted to see the Statue of Liberty.</i>,<i>همیشه دلم می‌خواست مجسمه آزادی رو ببینم</i>,عمرمو اینجا تو مکزیک قایم شم همینو بدون
05:42,05:44,Maybe we could blackmail him.,...شاید بتونیم ازش اخاذی کنیم,نمی‌دونم نمی‌دونم
05:45,05:47,And clear my name.,و بی‌گناهیم رو ثابت کنم,این می‌تونه جواب بده
05:47,05:48,<i>Let's go!</i>,<i>بزن بریم</i>,این می‌تونه جواب بده
05:49,05:51,<i>- Road trip!</i> - Let's get the hell out of here.,بیا از اینجا بزنیم به چاک,این می‌تونه جواب بده
05:52,05:54,<i>Keep the change!</i>,<i>باقیش باشه</i>,این کلیسا باعث شد از نیویورک بیرونم کنن
06:00,06:03,"We keep our heads down, and we keep moving.",،آسته‌طور عمل می‌کنیم و همینجور رامونو میریم,همیشه دلم می‌خواست مجسمه آزادی رو ببینم
06:06,06:07,<i>We are fugitives!</i>,<i>ما فراری‌ایم</i>,اسممو پاک کنم
06:07,06:10,<i>We are on the run!</i>,<i>ما متواری‌ایم</i>,سفر جاده‌ای
06:10,06:13,"<i>Yes, we are innocent. Yes.</i>",<i>،بله، ما بی‌گناهیم، اون که بله</i>,بزن از اینجا بریم
06:13,06:17,<i>But I will eat every bad guy that gets in our way.</i>,<i>ولی من هر چی بر و بچ بَدی که سد رامون بشه رو لقمه‌ش می‌کنم</i>,پول خرد هم ببر
06:17,06:19,I need a Tylenol.,استامینوفن لازمم,سرمون پایین باشه و ادامه بدیم
06:32,06:33,Do you hear that?,تو هم می‌شنوی؟,آره ولی هر کی بیاد جلو می‌خورمش
06:45,06:47,<i>Someone's in trouble.</i>,<i>یکی تو مخمصه‌ست</i>,
06:47,06:49,<i>And I need fuel for the road.</i>,<i>و منم که واسه جاده سوخت لازم دارم</i>,
06:49,06:50,"Yeah, okay.",آره، باشه,
07:11,07:12,<i>That way.</i>,<i>اینوری</i>,
07:23,07:25,"<i>Bad men, Eddie.</i>",<i>آدم بدا، ادی</i>,
07:26,07:30,"<i>Are we the Lethal Protector, or not?</i>",<i>ما ناسلامتی محافظ مرگباریم یا نه؟</i>,از اون طرف
07:34,07:35,Do your thing.,کارتو بیا,
07:35,07:36,<i>Easy-peasy.</i>,<i>بچه‌مچه‌بازیه</i>,
07:53,07:54,Jesus.,پروردگارا,
08:02,08:03,<i>Cute!</i>,<i>چه گوگولی</i>,
08:03,08:05,<i>I promise not to eat it.</i>,<i>قول میدم نخورمشون</i>,
08:07,08:09,They're fighting dogs.,اینا سگای جنگی‌ان,
08:09,08:12,"<i>I draw the line at fighting dogs, pal.</i>",<i>من سگای جنگی خط قرمزمه، عشقی</i>,
08:18,08:21,"<i>Oye, vato,</i> you're in the wrong place.",<i>هی رفیق</i> آدرس اشتباهی بهت دادن,با نمکه
08:22,08:23,"Oh, hello.",سلام علیکم,قول دادم نخورمش
08:24,08:25,This is our territory.,اینجا خاک مائه,قول دادم نخورمش
08:26,08:28,"Well, I assume",خب، نظر به,اونا سگ‌جنگی دارن
08:28,08:30,by the threatening look on your faces,نگاه هراس آفرین روی صورتتون ...فرضمه که من,با سگ‌جنگی‌ها حال نمی‌کنم داداش
08:30,08:33,"that I ought to be scared, right?",من باس بگرخم، درسته؟,با سگ‌جنگی‌ها حال نمی‌کنم داداش
08:35,08:38,"But you took the wrong path, <i>hermano.</i>",خب، انداختی تو مسیر اشتباهی دیگه، داداش,فقط یه چندتا
08:38,08:40,We can't let you leave.,ما هم نمی‌تونیم بذاریم بری,اوه چی؟
08:41,08:43,I have a headache,،من یه سردردی دارم,
08:43,08:47,on account of the fact that I was drinking a lot.,اونم رو حساب این واقعیت که لب تر کردم... اونم همینجور,اینجا قلمرو ماس
08:47,08:48,I'm gonna be honest.,می‌خوام روراست باشم,خب از اون قیافه‌های تهدیدآمیزتون  معلومه که
08:48,08:52,I have a really dark and unpredictable side to me.,من یه روی خیلی تاریک و غیرقابل پیش‌بینی دارم,خب از اون قیافه‌های تهدیدآمیزتون  معلومه که
08:52,08:54,We all have monsters inside us.,ماها همه هیولایی تومون داریم,باید بترسم مگه نه؟
08:55,08:56,Not like this.,اینجوریشو نه,بتمن. باید مسیر اشتباهی بریم
08:56,08:58,So dark that it is highly likely,اینقدر تاریک که قویا محتمله که,بتمن. باید مسیر اشتباهی بریم
08:59,09:02,to tear your head off and feed it,کَله‌تون رو از تنتون بکنه و بده به خورد مقعدتون,میتونیم بذاریم بری
09:02,09:03,to your asshole.,کَله‌تون رو از تنتون بکنه و بده به خورد مقعدتون,سردرد دارم
09:03,09:05,<i>Orme! You can feed it to me!</i>,می‌تونی بدیشون به خورد من,از بس که زیاد خوردم
09:05,09:06,"Yeah, or I can feed it to him.",آره، یا می‌تونم بدمشون به خورد اون,از بس که زیاد خوردم
09:08,09:10,All right. Look. Come on. I got a suggestion.,خیلی‌خب، نگاه بیخیال. من یه پیشنهادی دارم,من یه طرف خیلی تاریک و غیرقابل پیش‌بینی دارم
09:10,09:12,No. Stop speaking.,نه. بیفت از حرف زدن - من نمیفتم از حرف زدن -,من یه طرف خیلی تاریک و غیرقابل پیش‌بینی دارم
09:12,09:14,I'm not gonna stop speaking. This is for you.,این کار بخاطر خود شمائه,ما همه یه هیولا تو دلمون داریم
09:14,09:16,"I'm doing this for your benefit, all right?",دارم این کارو برای عاقبت بخیری خودتون می‌کنم، خب؟,ولی نه مثل من
09:16,09:18,I don't have to. Okay? So pay attention.,اجباری هم نیست برام، باشه؟ پس حواسا رو بذارین,اونقدر تاریک که احتمالش خیلی زیاده سرتو بکنم و بدم دستت
09:19,09:21,We're gonna find all of these dogs loving forever homes,ماها قراره برای همه‌ی این سگا خونه‌های بامحبتِ تا همیشه پیدا کنیم,اونقدر تاریک که احتمالش خیلی زیاده سرتو بکنم و بدم دستت
09:21,09:23,because what you're doing is reprehensible.,قباحت داره,اونقدر تاریک که احتمالش خیلی زیاده سرتو بکنم و بدم دستت
09:23,09:26,"What does your mother think of you, man?",و مادرتم چی درباره‌ت فکر می‌کنه آخه، آقا جون؟,من اینجام بده به من بخورمش
09:26,09:28,"My mother's dead, <i>culero.</i>",مادر من مُرده، عوضی,ببین نگاه کن اوه اوه بیا اینجا
09:28,09:29,<i>You made it awkward!</i>,<i>زدی ناجورش کردی</i>,ببین نگاه کن اوه اوه بیا اینجا
09:30,09:31,I'm sorry to hear that.,غم آخرت باشه - <i>خفه‌شو</i> -,یه پیشنهاد دارم
09:40,09:42,I'm giving you a chance.,دارم بهتون یه فرصت میدم,همیشگی و دوست‌داشتنی پیدا کنیم چون کار شما واقعا حال بهم زنه
09:42,09:44,"Sweetie, I really am giving you a chance.",قند عسل، خدایی دارم بهتون یه فرصت میدم,و مادرت دربارت چی فکر می‌کنه رفیق؟
09:44,09:46,You should probably take it.,احتمالا هم باید این فرصتو برش‌دارین,و مادرت دربارت چی فکر می‌کنه رفیق؟
09:53,09:54,<i>Say when.</i>,<i>بگو کِی -</i> کِی -,آره؟
09:54,09:55,When.,<i>بگو کِی -</i> کِی -,بخشی از ماجراست
10:05,10:07,"<i>Hola,</i> bitches.",سام علیک، لاشی‌ها,عزیزم دارم واقعاً یه شانس بهت میدم بهتره قبول کنی
10:32,10:34,Who's a bad boy?,این پسر بدمون کیه؟,
10:41,10:43,Now that's some sturdy footwear!,<i>الان به این میگن یه پاپوشِ چینی نساخت</i>,
10:46,10:47,Where you going?,کجا تشریف‌فرمایی؟,کی بچه بده؟
10:48,10:50,Home.,خونه,کی بچه بده؟
10:50,10:51,Nah.,نع,کی بچه بده؟
10:59,11:00,What...,تو دیگه... چی هستی؟,میرم یه کفش محکم گیر بیارم
11:02,11:03,are you?,تو دیگه... چی هستی؟,میرم یه کفش محکم گیر بیارم
11:05,11:06,We are...,...ما - ما ونومیم -,داری میری؟
11:06,11:08,We are Venom!,...ما - ما ونومیم -,داری میری؟
11:08,11:10,We are...,...ما - ونوم هستیم -,
11:10,11:11,- Venom! - No!,نه,
11:11,11:13,- Oh! - Yeah.,آره، ما... ونوم هستیم - ما ونوم هستیم -,
11:13,11:14,- We... - We...,آره، ما... ونوم هستیم - ما ونوم هستیم -,
11:14,11:17,are Venom.,آره، ما... ونوم هستیم - ما ونوم هستیم -,چی؟
11:18,11:19,What?,چی؟,چی؟
11:20,11:23,We are totally gonna need to work on that.,همه‌جوره باید صیقلش بدیم,داری میری؟
11:31,11:34,<i>That was delicious!</i>,<i>روشن شدما</i>,آره ما
11:34,11:35,You're welcome.,قابلتو نداشت,ما میریم
11:36,11:37,Thank you.,تشکر,ونوم
11:37,11:40,<i>You take me to all the finest places!</i>,<i>تو منو می‌بری به همه‌ی جاهای خوش‌‌ترین</i>,چیه؟
11:40,11:42,Let's get the hell out of here.,بیا از اینجا گم شیم بریم,باید حسابی روش کار کنیم
11:42,11:43,Where's my shoe?,کفشم کوشش؟,باید حسابی روش کار کنیم
11:44,11:45,"Oh, hey, buddy!",سلام رفیق,یالا
11:45,11:48,That's my shoe! That's my shoe. That's my shoe!,این کفش منه این کفش منه,
11:48,11:49,Give me my shoe.,کفشمو بده,
11:56,11:58,<i>These will fit.</i>,<i>اینا اندازه‌ت میشنا</i>,همیشه منو می‌بری بهترین جاها
11:58,12:00,Now we are on the run,حالا دیگه متواریَ رو هستیم,همیشه منو می‌بری بهترین جاها
12:00,12:02,for something we actually did do.,اونم واسه کاری که واقعا کردیم,بزن بریم از اینجا
12:02,12:04,And I got stuck with a superhero who can't fly.,و افتادمم گیر یه ابرقهرمانی که پرواز بلد نیست,کفشم کجاست؟
12:04,12:05,<i>Wanna bet?</i>,<i>سرش شرط ببندیم؟</i>,اوه سلام داداش
12:31,12:33,There you are.,ایناهاشی,یه خورده دیگه. آهان اینجاست
12:36,12:38,Get me General Strickland.,ژنرال استریکلند رو برام بگیر,یه خورده دیگه. آهان اینجاست
12:57,12:58,What the...?,...این دیگه چه,
13:07,13:08,Viral shedding.,پخش ویروسیه,
13:10,13:11,These things wanna live.,این چیزا دلشون می‌خواد زنده بمونن,
13:20,13:23,Tell me about the man who was just here.,از مردی که همین تازگی اینجا بود برام بگو,
13:28,13:30,"He was acting, like, crazy. Talking to himself.",،اون رفتارش، مثل، دیوونه‌ها بود .با خودش حرف میزد,این موجودا می‌خوان زنده بمونن
13:31,13:33,What was he saying?,چی می‌گفت؟,
13:34,13:39,"He had these big, massive, wild arms.",یه، یه دستای گنده‌ی، غوله، افسارگسیخته داشت,سلام
13:39,13:40,They were bobbling like this.,اینجوری موج میزدن,بگو این یارو که الان اینجا بود کی بود
13:43,13:44,Bring him.,بیارینش,یه جوری رفتار می‌کرد انگار خل و چل شده واسه خودش حرف می‌زد
14:03,14:05,<i>You think there are another brother and sister</i>,<i>به نظرت</i>,داشتن یه جوری قل‌قل می‌کردن بیارینش
14:05,14:06,<i>on one of those stars...</i>,<i>خواهر و برادر دیگه‌ای ...رو یکی از اون ستاره‌ها هستن که</i>,داشتن یه جوری قل‌قل می‌کردن بیارینش
14:08,14:10,looking at the same sky?,دارن به همین آسمون نگاه می‌کنن؟...,داشتن یه جوری قل‌قل می‌کردن بیارینش
14:10,14:12,I'll be able to tell you one day.,یه روز می‌تونم اینو بهت بگم,داشتن یه جوری قل‌قل می‌کردن بیارینش
14:16,14:17,My twin brother...,،برادر دوقلوی من,داشتن یه جوری قل‌قل می‌کردن بیارینش
14:17,14:19,a future NASA scientist.,دانشمند آینده ناسا,داشتن یه جوری قل‌قل می‌کردن بیارینش
14:20,14:22,One day.,یه روز,داشتن یه جوری قل‌قل می‌کردن بیارینش
14:25,14:27,"When thunder roars, head indoors.",،صدای غرش رعد رو که شنیده برین تو فضای پوشیده,فکر می‌کنی یه خواهر و برادر دیگه‌ای تو یکی از اون ستاره‌ها باشن؟
14:45,14:46,No!,نه,وقتی رعد می‌زنه .برو داخل
15:19,15:20,<i>He's on life support.</i>,به دستگاه تنفس وصله,
15:20,15:22,<i>Get him to emergency symbiosis now.</i>,"<font face=""Segoe UI"" color=""#d4eef3""><b>در مالکیت دولت ایالات متحده] [پاتریک مولیگان</b></font>",
15:36,15:37,It should be you.,باید تو می‌بودی,
15:40,15:41,<i>This just came across our news desk</i>,<i>این خبر به تازگی ،اتفاقی به طول تحریریه ما خورده</i>,به پیوند همزیستی ببرینش فوراً
