Start Time,End Time,English,Venom.The.Last.Dance.2024.BluRay.Film2Media.srt,Venom_The_Last_Dance_open subtitle.srt
15:41,15:42,<i>and it bears repeating:</i>,<i>و لازم به بازگوییه</i>,به پیوند همزیستی ببرینش فوراً
15:42,15:45,"<i>For all of you alien enthusiasts out there, it's a sad day.</i>",<i>برای همه‌ی شما خوره‌های فضایی اون بیرون روز غم‌باریه</i>,
15:46,15:49,<i>Washington has finally announced the decommissioning of Area 51.</i>,"<i>منطقه 51"" رو اعلام کرد""</i> <font face=""Calibri"" color=""#fdffae""><b>یه پایگاه نظامی سری تو ایالات متحده که در صحرای نوادا واقع شده و شدیدا تحت محافظت دولتی قرار داره) (بیشتر هم به دلیل شایعاتی درباره نگهداری نمونه‌های حیات فضایی توش مشهور شده</b></font>",
15:50,15:51,<i>The controversial site is famous</i>,<i>این تاسیسات بحث‌برانگیز به سببِ</i>,
15:51,15:53,<i>for its alleged testing on aliens.</i>,<i>آزمایشات مورد ادعا بر روی بیگانگان شهره‌ست</i>,
15:54,15:55,<i>In other news today...</i>,<i>...در سایر اخبار امروز</i>,باید تو باشی
16:08,16:11,Right this way. Come on up.,,این محل معروف به آزمایشات روی فضایی‌ها بود
16:26,16:29,- Strickland. <i>- Strickland authorized.</i>,<i>استریکلند مجاز است</i>,از این طرف بفرمایید
16:45,16:47,"- It's finally happening, then. - Yeah.",پس بالاخره داره میشه,استریکلند
16:48,16:51,"Yes, ma'am. Be nothing left but rock and dust.",هیچی جز سنگ و خاک هم نمی‌مونه,اجازه از استریکلند
16:51,16:52,And roaches.,و سوسکا,
16:52,16:55,Even the biggest of bangs couldn't kill 'em.,حتی بزرگترین انفجارها هم نمی‌تونه بکششون,
16:55,16:58,They've been around 280 million years. And counting.,اونا حول و حوش 280 میلیون سال که روشم داره میاد، هستن,
16:58,16:59,"I did not know that, Dr. Paine.",اینو نمی‌دونستم، دکتر پِین,
17:07,17:08,Good to go.,مشکلی برای رفتن ندارین,
17:08,17:09,"- Have a good one, Gus. - You too.",روزت خوش، گاس - همینطور -,دیگه فقط سنگ و خاک باقی می‌مونه
17:43,17:46,"- Thank you. - Yes, ma'am.",با تشکر - بله خانم -,
17:51,17:54,"Morning, Dr. Paine, we'll keep 'em safe for you.",صبح‌بخیر دکتر پِین ما براتون امن نگهشون می‌داریم,
17:54,17:56,"I still don't think anyone wants my old beater, Jim.",هنوزم فکرمه که کی آخه ابوقراضه زوار دررفته منو می‌خواد، جیم,
17:56,17:57,Never judge a book by its cover.,هیچ‌وقت از رو ظاهر قضاوت نکن,
18:02,18:05,"Early morning wake-up, General Strickland.",بیدار باش کله سحریه، ژنرال استریکلند,مرسی
18:05,18:07,Looks like all your dreams came true.,ظاهرا که همه‌ی رویاهات رنگ واقعیت گرفته,آماده‌ست
18:07,18:09,I know how that must bug you.,می‌دونم چجوری هم لابد مایه عذابت شده,
18:10,18:13,He arrived shortly before you did.,اون یه کم قبل تو رسید,صبح بخیر دکتر پین
18:13,18:14,Did our new friend give him any trouble?,دوست جدیدمون اسباب دردسری براش شد؟,هنوز فکر نمی‌کنم کسی  باشگاه قدیمی منو بخواد
18:14,18:16,"You see, that's exactly the problem.",،توجه میکنی مشکل دقیقا همینه,منو اجرا کنی؟  H-couple حالا می‌خوای
18:16,18:17,What?,چی؟,منو اجرا کنی؟  H-couple حالا می‌خوای
18:17,18:19,Your assumption we're meeting friends.,که فرضته داریم دوستانی رو می‌بینیم,
18:21,18:23,- Morning. - Good morning.,صبح‌بخیر,صبح زود بیدار شو ژنرال استریکلند
18:23,18:25,The bonding was successful.,پیوند موفقیت‌آمیز بود,مثل اینکه تمام رویاهات به واقعیت پیوسته
18:25,18:26,I heard.,شنیدم,مثل اینکه تمام رویاهات به واقعیت پیوسته
18:31,18:33,You always have this look on your face,تو همیشه خدا این ریختُ رو صورتت که انگار,اون درست قبل از شما اومده
18:33,18:34,like something terrible is imminent.,یه چیزی وحشتناکی قریب‌الوقوعه رو داری,دوستمون دردسر ایجاد کرد؟
18:34,18:35,Because in my line of work,،چون در حیطه کاری من,ببین این دقیقاً مشکلشه
18:35,18:37,something terrible <i>is</i> always imminent.,یه چیز وحشتناک همیشه خدا قریب‌الوقوعه,فرض می‌کنی داریم با دوست‌ها ملاقات می‌کنیم
18:38,18:40,"We contain them, you study them.",،ما مهار و کنترلشون می‌کنیم شما روشون مطالعه می‌کنین,فرض می‌کنی داریم با دوست‌ها ملاقات می‌کنیم
18:40,18:42,It's how it works.,روالش اینجوریه,صبح بخیر
18:49,18:50,Let's have a look.,بیاین یه نگاهی بندازیم,
18:50,18:52,"- Hello, doctor. - Morning.",سلام دکتر - صبح‌بخیر -,همیشه اینجوری نگاه می‌کنی انگار یه چیز وحشتناک در راهه
18:52,18:54,His other symbiote left him for dead.,سیمبیوت دیگه‌ش ولش کرد بمیره,همیشه اینجوری نگاه می‌کنی انگار یه چیز وحشتناک در راهه
18:56,18:58,<i>We saved him.</i>,<i>ما نجاتش دادیم</i>,ما محدودشون می‌کنیم
18:58,18:59,He would have died.,"{\an8}<font face=""Segoe UI"" color=""#ffff00""><b>[همزیستی تکمیل شد]</b></font>",تو مطالعه‌شون می‌کنی
19:03,19:04,"Oh, try lowering those levels.",سعی کنین این سطوح رو پایین بیارین,
19:11,19:12,"Morning, Sadie.",صبح‌بخیر سِیدی,همزیست دیگه‌ش ولش کرده بود تا بمیره
19:12,19:14,Let me get that.,بذار بگیرمش,همزیست دیگه‌ش ولش کرده بود تا بمیره
19:14,19:15,We got this down in Mexico.,ما این رو از مکزیک گیر آوردیم,
19:15,19:18,Hi. Welcome.,سلام. خوش اومدی,ما نجاتش دادیم
19:19,19:20,Any more on where the rest of him is?,هیچ خبر بیشتری هست که باقیش کجاست؟,
19:20,19:23,- We're gettin' there. - Update me as you have it.,داریم به اونجاشم می‌رسیم - خبرش رو که داشتی در جریانم بیار -,سعی می‌کنم سطح‌ها رو بیارم پایین
19:25,19:27,I don't get this obsession.,من که گیراییم این دلبستگی رو نمیکشه,
19:27,19:29,I told you. My mom made me this pin.,...گفتم که بهت مامانم این سنجاق سینه رو برام درست کرده,
19:29,19:30,It's July.,الان که ماه جولای‌ـه,صبح بخیر سدی
19:31,19:32,I'll see you in there.,اونجا می‌بینمت,برمی‌گردم
19:35,19:36,Everyone on this side...,همه تو این سمت... عجیب و غریبن,سلام
19:37,19:39,is weird.,همه تو این سمت... عجیب و غریبن,اطلاعات بیشتری از بقیه‌شون داری؟
19:39,19:40,"Leave her alone, Rex.",چیکارش داری، رِکس,اطلاعات بیشتری از بقیه‌شون داری؟
19:40,19:43,God forbid anyone should actually enjoy their work.,یعنی خدا نکنه اگه کسی راستُ واقعی کِیف کارش رو ببره‌ها,بهم خبر بده اگه چیزی دستت اومد
19:58,20:00,Area 51 will be fully decommissioned,منطقه 51 تا آخر هفته,ولش کن رکس
20:00,20:01,by the end of the week.,به طور کامل برچیده میشه,انگار کسی دلش بخواد واقعاً از کارش لذت ببره
20:01,20:02,"It's just a shipwreck anyway,",،به هر حال اینجا فقط یه کشتی غرق شده‌ست,انگار کسی دلش بخواد واقعاً از کارش لذت ببره
20:02,20:04,and they're tired of the tourists.,و اونا از گردشگرا هم خسته شدن,
20:04,20:07,But we don't exist down here.,ولی ما این زیرش که وجودیتی نداریم,
20:07,20:08,A hundred feet subsurface...,،سی متر زیر سطح,
20:08,20:11,undetectable to any human...,...که برای هر انسانی از تشخیص خارجه,
20:12,20:13,or nonhuman.,یا غیر انسان,
20:13,20:15,No one's phoning home from here.,از اینجا هیچ‌کی به خونه‌ش زنگ نمیزنه,
20:15,20:17,My brother's greatest ambition,،بزرگترین سودای برادرم,
20:17,20:20,was to work up there at 51 doing what I do.,این بود که اینجا تو منطقه 51 کار کنه و کاری که من میکنم رو کنه,منطقه ۵۱ تا آخر هفته کامل برچیده میشه
20:21,20:22,And I wish I could have shown him,کاشکی می‌تونستم بهش نشون بدم ما این پایین چی ساختیم,در هر صورت چیزی جز یه کشتی خراب نیست و از توریستا خسته شدن
20:22,20:23,what we've built down here.,کاشکی می‌تونستم بهش نشون بدم ما این پایین چی ساختیم,در هر صورت چیزی جز یه کشتی خراب نیست و از توریستا خسته شدن
20:28,20:29,<i>You're okay.</i>,تو خوبی,صد فوت زیر زمین طوری که نه آدمیزاد می‌تونه پیدامون کنه نه غیر آدمیزاد
20:29,20:30,<i>Just...</i>,فقط... سعی کن نفس بکشی,صد فوت زیر زمین طوری که نه آدمیزاد می‌تونه پیدامون کنه نه غیر آدمیزاد
20:32,20:34,<i>try to breathe. Okay?</i>,فقط... سعی کن نفس بکشی,همه از اینجا دارن زنگ می‌زنن خونشون
20:35,20:37,When my brother and I were kids,تو بچگیای من و برادرم، بهمون می‌گفتن که,بزرگترین آرزوی داداشم این بود که اون بالا تو منطقه ۵۱ کار کنه همون کاری که من اینجا می‌کنم
20:37,20:40,"they told us that UFOs were just weather balloons, space trash.",بشقاب پرنده‌ها فقط بالن‌های هواشناسی و ضایعات فضایی‌ان,بزرگترین آرزوی داداشم این بود که اون بالا تو منطقه ۵۱ کار کنه همون کاری که من اینجا می‌کنم
20:41,20:44,Kubrick directed the moon landing in a Hollywood studio.,"که ""کوبریک"" نشستن روی ماه رو تو یه استودیوی هالیوودی، کارگردانی کرده <font face=""Calibri"" color=""#fdffae""><b>(استنلی کوبریک، کارگردان بسیار معروف آمریکایی)</b></font>",و کاش می‌تونستم بهش نشون بدم اینجا چی ساختیم
20:45,20:46,Cool story.,چه داستان باحالی,
20:46,20:48,Where are you going? This first.,کجا میری؟ اول این,خوبی
20:48,20:50,Is there an increased risk of exposure?,خطر مضاعفی‌ـه که در معرضشیم؟,...فقط
20:51,20:53,It's not us I'm worried about.,این ما نیستیم که من نگرانشم,نفس بکش
20:53,20:56,You know we carry all kinds of viruses and bacteria,می‌دونی ما ناقل انواع و اقسام ویروس‌ها و باکتری‌هایی هستیم که,وقتی من و داداشم بچه بودیم می‌گفتن بشقاب پرنده‌ها فقط بادکنک هواشناسی‌ان
20:56,20:57,that could be harmful to a sensitive lifeform.,می‌تونه برای یه موجود زنده حساس مضر باشه,وقتی من و داداشم بچه بودیم می‌گفتن بشقاب پرنده‌ها فقط بادکنک هواشناسی‌ان
20:57,21:00,And we don't know exactly what we're dealing with here.,و ما هم که نمی‌دونیم دقیقا اینجا سر و کارمون با چیه,وقتی من و داداشم بچه بودیم می‌گفتن بشقاب پرنده‌ها فقط بادکنک هواشناسی‌ان
21:01,21:02,As long as we're keeping the guests safe.,تا زمانی که باهاش مهمونامون رو در امنیت نگه می‌داریم، باشه,کوبریک تو یه استودیوی هالیوودی فرود ماه رو کارگردانی کرده
21:09,21:11,This is the first time we've had a host,یه میزبان سازگار با یکی از سیمبیوت‌هامون داریم,نگران خودمون نیستم
21:11,21:12,compatible with one of our symbiotes.,یه میزبان سازگار با یکی از سیمبیوت‌هامون داریم,نگران خودمون نیستم
21:12,21:14,And now we'll be able to talk to one.,با یکیشون حرف بزنیم,می‌دونی که ما کلی ویروس و
21:17,21:18,<i>Monsters.</i>,<i>هیولاها</i>,و دقیقاً نمی‌دونیم با چی طرفیم
21:33,21:36,He's been experiencing panic surges since we bonded him.,از وقتی پیوند رو زدیم دچار طغیان وحشت‌زدگی شده,از وقتی بهش متصل شدیم دچار موج‌های اضطرابی شده
21:36,21:39,"You try ""Jingle Bells""? So soothing.","سرود کریسمس ""زنگ‌های جرینگ‌جرینگ‌کنان"" رو امتحان کردی؟",از وقتی بهش متصل شدیم دچار موج‌های اضطرابی شده
21:39,21:41,"Wow, why didn't I think of that?",وای. چرا به فکرم نرسیده بود؟,از وقتی بهش متصل شدیم دچار موج‌های اضطرابی شده
21:43,21:45,Release him.,آزادش کن,از وقتی بهش متصل شدیم دچار موج‌های اضطرابی شده
21:49,21:50,<i>Monsters.</i>,<i>هیولاها</i>,از وقتی بهش متصل شدیم دچار موج‌های اضطرابی شده
21:53,21:55,<i>I'm Dr. Paine. Teddy.</i>,من دکتر پِینم,از وقتی بهش متصل شدیم دچار موج‌های اضطرابی شده
21:57,21:58,You're safe here.,تو اینجا جات امنه,آرامش‌بخشه
21:58,22:00,I'm going to help you.,من می‌خوام کمکت کنم,خب چرا خودم به ذهنم نرسید؟
22:01,22:02,Both of you.,به هردوتون,
22:04,22:06,The transfer was successful.,انتقال موفقیت‌آمیز بود,سلام
22:07,22:09,We had no choice.,ما چاره دیگه‌ای نداشتیم,
22:09,22:10,We had to try and save you.,<i>باید سعی رو برای نجاتت می‌کردیم</i>,
22:18,22:19,<i>Monsters.</i>,<i>هیولاها</i>,کمکت می‌کنم
22:27,22:28,<i>You're broken too.</i>,<i>تو هم ضرب‌دیده‌ای</i>,چاره‌ای نداشتیم
22:37,22:38,<i>May I...?</i>,...اجازه هست,هیولاها
22:43,22:44,<i>May I ask you some questions?</i>,اجازه هست یه سری سوال ازت بپرسم؟,
22:50,22:52,Is the symbiote communicating with you?,این سیمبیوت باهات ارتباط داره؟,
22:55,22:56,<i>Do you hear it?</i>,صداش رو می‌شنوی؟,
22:59,23:01,Sound distresses them.,صوت، آزرده‌شون میکنه,
23:03,23:04,<i>Okay.</i>,باشه,میشه چندتا سوال بپرسم؟
23:08,23:10,<i>- Why are they here? - What do they want?</i>,اونا چرا اینجان؟,این سیمبیوت باهات ارتباط برقرار کرده؟
23:10,23:11,<i>Safe haven.</i>,<i>پناهگاه امن -</i> پناهگاه امن؟ -,این سیمبیوت باهات ارتباط برقرار کرده؟
23:12,23:13,<i>Safe haven?</i>,<i>پناهگاه امن -</i> پناهگاه امن؟ -,
23:13,23:15,<i>We were running.</i>,<i>ما در حال فرار بودیم</i>,می‌شنویش؟
23:16,23:17,<i>Is he talking about the other symbiotes?</i>,داره راجع به بقیه سیمبیوت‌ها حرف میزنه؟,
23:17,23:19,<i>I think so.</i>,فکر کنم,صدا اذیتشون می‌کنه
23:19,23:23,His creatures search the universe for us.,<i>مخلوقات اون، هستی رو در جستجوی مائن</i>,باشه
23:24,23:25,<i>But we will be found.</i>,<i>با این اوصاف ما پیدا میشیم</i>,
23:28,23:31,"<i>And when we are, he will kill us all.</i>",<i>،و وقتی هم بشیم</i> <i>اون همه‌مون رو میکشه</i>,چی می‌خوان؟
23:33,23:34,Who?,کی؟,داشتیم فرار می‌کردیم
23:35,23:36,<i>There will be nothing left.</i>,<i>هیچی باقی نمی‌مونه</i>,داره درباره بقیه سیمبیوتا حرف میزنه؟
23:38,23:39,<i>Here? On Earth?</i>,اینجا؟ روی زمین؟,موجوداتش کل جهان رو دنبال ما می‌گردن
23:43,23:44,Why were they running?,چرا در حال فرار بودین؟,حالمون خوب میشه
23:45,23:48,"<i>Because there is a dark,</i>",<i>چون دریایی تاریک</i>,و وقتی خوب شدیم همه‌مون رو می‌کشه
23:48,23:51,<i>cold sea</i>,<i>و سرد</i>,و وقتی خوب شدیم همه‌مون رو می‌کشه
23:52,23:54,<i>around this universe.</i>,<i>دورِ این هستی‌ـه</i>,کی؟
23:54,23:55,<i>What is it?</i>,چی هستش؟,هیچ‌چیزی باقی نمی‌مونه
24:03,24:05,<i>You don't wanna know.</i>,<i>دلتون نمی‌خواد بدونین</i>,چون یه تاریکی
24:15,24:17,<i>I've seen the future.</i>,<i>من آ، آینده رو دیـ ،دیدم</i>,چی؟
24:35,24:37,<i>The darkness</i>,<i>...تاریکی</i>,آینده رو دیدم
24:39,24:43,<i>has teeth.</i>,<i>نیش داره</i>,
24:48,24:49,<i>This is your captain speaking.</i>,<i>کاپیتانتون صحبت میکنه</i>,
24:49,24:53,"<i>We are currently cruising at a comfortable 31,000 feet.</i>",<i>ما هم‌اینک در ارتفاع آسوده خاطر 31 هزار پا در حال پیمایش هستیم</i>,اون تاریکی
24:53,24:56,"<i>If you look out there to your left just now,</i>",<i>اگه همین الان بیرون رو ،در سمت چپتون نگاه کنید</i>,اون تاریکی
24:56,24:58,<i>you'll see the Grand Canyon.</i>,<i>دره گِرَند کَنیون رو می‌بینید</i>,باید بره
25:01,25:02,<i>Told you we could fly.</i>,<i>گفتم که ما پرواز بلدیم</i>,باید بره
25:02,25:03,"Oh, my God!",یا خداوندا,باید بره
25:04,25:05,<i>Direct to New York.</i>,<i>نیویورک بدون توقف</i>,
25:05,25:07,My mouth is so dry!,دهنم خشکِ خشک شده,
25:07,25:09,<i>And we clear your name.</i>,<i>و بی‌گناهیت رو هم ثابت می‌کنیم</i>,کاپیتان داره صحبت می‌کنه
25:09,25:11,It's so unpleasantly cold!,هوا بس ناجوانمردانه سرد است,در حال حاضر در ارتفاع ۳۱هزار فوت داریم پرواز می‌کنیم
25:12,25:14,How does Tom Cruise do this?,تام کروز چجوری آخه این کارو میکنه؟,اگه به سمت چپتون نگاه کنین الان گرند کنیون رو می‌بینین
25:14,25:16,<i>He doesn't whine like a little bitch!</i>,<i>اون مثل یه لاشی فکستری نقُ‌نق نمیکنه</i>,اگه به سمت چپتون نگاه کنین الان گرند کنیون رو می‌بینین
25:28,25:29,<i>What was that?</i>,این چی بود دیگه؟,خیلی یخ کرده
25:33,25:34,<i>What is that?</i>,این دیگه چیه؟,همه اون دخترای قدبلند دارن انجامش میدن
25:34,25:36,"Oh, fuck!",<i>...اَی کیـ</i>,مثل یه بچه غر نمی‌زنه
25:59,26:01,"I'm sorry, Eddie, but I got to disappear.",،شرمنده‌ت ادی ولی باید ناپیدا شم,
26:02,26:04,"- What, now? <i>- We're in deep shit!</i>",چی، الان؟ - <i>تا خرتناق رفتیم تو گوه -</i>,
26:06,26:08,Why did you do that?,چرا این کارو کردی؟,
26:09,26:10,<i>I will explain.</i>,<i>توضیح میدم</i>,ببخشید آنا
26:11,26:13,No! No!,نه! نه,ولی باید غیب بشم
26:17,26:18,No! No!,نه! نه,مترجم : مستر مووی کانال تلگرام : @MRMOVIEHC
26:24,26:26,I'm gonna go ahead and say that,می‌خوام رودربایسی رو بذارم کنار و بگم که,چرا این کارو کردی؟
26:26,26:28,this is the shittest hangover of all time.,این ریدمال‌ترین خماریه تمامیه دورانه,چرا این کارو کردی؟
26:29,26:31,"<i>Look at it, Eddie.</i>",<i>اینجا رو بنگر، ادی</i>,توضیح می‌دم
26:31,26:33,<i>Isn't it just astonishing?</i>,<i>واحیرتا نیست اصلا؟</i>,این بدترین خماری تمام عمرم بود
26:33,26:35,"Oh, shut up.",خفه بابا,این بدترین خماری تمام عمرم بود
26:35,26:38,<i>I don't think I mind living here forever.</i>,<i>تا همیشه اینجا خونه و زندگیم باشه</i>,این بدترین خماری تمام عمرم بود
26:38,26:41,We just came face-to-face with a literal death machine.,ماشین مرگِ به معنای واقعی کلمه رخ به رخ شدیما,این بدترین خماری تمام عمرم بود
26:41,26:44,Forever seems pretty optimistic.,تا ابد که قشنگ دلِ خوشی داشتن می‌مونه,این بدترین خماری تمام عمرم بود
26:50,26:53,"<i>With the decommissioning of Area 51, will the Pentagon</i>",<i>،با برچیده شدن منطقه 51</i>,عالی نیست؟
26:53,26:55,<i>finally admit that they've been holding UAPs?</i>,"<i>آیا پنتاگون سرانجام به اینکه ""آن‌ها ""یو‌اِی‌پی</i>",فکر نمی‌کنم بد باشه که تا ابد اینجا زندگی کنیم
26:55,26:58,"That's ""unidentified aerial phenomena"" to you.","معنیش واسه شما ""اشیای ناشناس پرنده"" هستش",تازه با یه ماشین مرگ واقعی رو به رو شدیم
26:58,27:00,"Yeah, Dad, we know.",آره، بابا، خودمون می‌دونیم,تازه با یه ماشین مرگ واقعی رو به رو شدیم
27:00,27:03,What I wouldn't give to see who built one of those things.,آخ که چیا رو واسه دیدن کسی که یکی از اونا رو ساخته، نمی‌دادم,تا ابد خیلی خوش‌بینانه‌س
27:03,27:04,That's why we cashed in our savings,برای همینم پس‌اندازمون رو نقد کردیم و,
27:05,27:06,"and came on this road trip, babe.",این سفر جاده‌ای رو اومدیم، عزیزم,
27:07,27:08,So you could finally get to see...,...تا بالاخره فرصت نصیبت شه ببینی,
27:08,27:10,That it's bullshit?,که خزعبله؟,... ،با تعطیل شدن منطقه 51
27:10,27:11,"Yeah, well, what if I'm right?",آره، خب، اگه حق با من باشه چی؟,... ،با تعطیل شدن منطقه 51
27:11,27:13,Then I really hope we don't end up,پس واقعا دعا دعا می‌کنم که آخر و عاقبتمون,پنتاگون دیگه انکار نکرد که یوفو داره؟
27:13,27:15,in an alien space lab with probes up our asses.,تو یه آزمایشگاه فضایی آدم فضاییا با میله کاوشیِ کرده شده تو کینمون نشه,پنتاگون دیگه انکار نکرد که یوفو داره؟
27:16,27:17,Or dead.,یا نعش,یعنی همون پدیده‌های هوایی ناشناخته که به شما می‌گیم
27:17,27:18,"""Asses.""","""کین""",یعنی همون پدیده‌های هوایی ناشناخته که به شما می‌گیم
27:28,27:30,Kicked up some gravel there.,چه یه مقدار شن و سنگ‌ریزه‌ای اونجا بلند شد,آره اگه حق با من باشه چی؟
27:30,27:32,"- Hang tight, family. - You good?",سفت بچسبین، خونواده - خوبین؟ -,واقعا امیدوارم کارمون به آزمایشگاه فضایی بیگانه‌ها و این داستانا نکشه
27:32,27:34,That was wild!,عقل از سر ببر بود,واقعا امیدوارم کارمون به آزمایشگاه فضایی بیگانه‌ها و این داستانا نکشه
27:34,27:35,- Did the dog vomit? - Yeah.,سگ بالا آورد؟ - آره -,همه‌مون می‌میریم
27:48,27:50,<i>Okay!</i>,<i>خیلی‌خب</i>,بیاین نزدیک .خانوادگی
27:50,27:51,<i>We've got this.</i>,<i>داریمش</i>,همه خوبین؟
27:51,27:54,<i>Soft landing. Bend your knees.</i>,<i>فرود آروم میایم. زانوهاتو خم کن</i>,سگ بالا آورد؟
27:54,27:56,<i>Engage your core. Engage your core!</i>,<i>عضلات کمر و پایینت رو درگیر کن</i> <i>دِ عضلات کمر و پایینت رو درگیر کن</i>,آره
27:57,28:00,"<i>Yes! Yes, that's it! Yes. That's it!</i>",<i>آره. همینه</i>,
28:03,28:05,<i>Well done.</i>,<i>بارِکلا</i>,
28:05,28:06,That was terrifying.,رعب و وحشت‌افکن بود,
28:08,28:10,This is not New York.,اینجا نیویورک نیستا,ما از پسش برمیایم
28:10,28:11,"No, this is a wasteland.",نه، اینجا برهوته,فرود نرم
