Start Time,End Time,English,Interstellar 2014 DVDScr FaSub Remington[Edited].srt,Interstellar 2014 HQ DVDScr FaSub Remington.srt,Interstellar 2014.srt,Interstellar BluRay 1080p 720p Fa.Remington.srt,Interstellar-2014-720p_IMDB-DL.Com.srt,Interstellar.2014.720p.BluRay.x264-DAA.srt,Interstellar.2014.ALL.BLURAY.9Movie.WorldSubtitle.srt,Interstellar.2014.BluRay.1080p.720p.Fa.srt,Interstellar.2014.BluRay.NightMovie.srt,Interstellar1080farsi.srt,persian1.srt
74:21,74:24,She probably just died minutes ago.,"داده‌ای که ""دویل"" دریافت کرده بود حالت بی‌پایان پژواک امواج بود","داده‌ای که ""دویل"" دریافت کرده بود حالت بی‌پایان پژواک امواج بود",احتمالا همين چند دقيقه قبل مُرده,احتمالاً چند دقیقه پیش مُرده بود,.احتمالاً چند دقیقه پیش مرده,احتمالاً همین چند دقیقه پیش هم مُرده,...پس احتمالا چند دقيقه پيش مرده,احتمالا همين چند دقيقه قبل مُرده,احتمالا چند دقيقه قبل مرده,احتمالا هم همین چند دقیقه پیش مرده بوده,احتمالا همين چند دقيقه قبل مُرده
74:24,74:28,CASE: The data Doyle received was just the initial status echoing endlessly.,"داده‌ای که ""دویل"" دریافت کرده بود حالت بی‌پایان پژواک امواج بود","داده‌ای که ""دویل"" دریافت کرده بود حالت بی‌پایان پژواک امواج بود",،اطلاعاتي که دويل دريافت کرده بود وضعيت اوليه بوده که پيوسته پژواک پيدا ميکرده,"داده‌ای که ""دویل"" دریافت کرده بود حالت بی‌پایان پژواک امواج بود","،داده‌هایی که ""دویل"" دریافت کرده بود .احتمالاً آخرین اعلام وضعیت اونا بوده",،داده‌هایی که دویل دریافت کرده بود فقط تکرار بی‌پایان حالت اولیه بودن,"اطلاعاتي که ""دويل"" دريافت کرد، فقط انعکاسي بي پايان .از وضعيت اوليه بود",،اطلاعاتي که دويل دريافت کرده بود وضعيت اوليه بوده که پيوسته پژواک پيدا ميکرده,اطلاعاتي که دويل دريافت کرده بود موقعيت اوليه بود که بينهايت بار داشت تکرار مي شد,"اطلاعات ""دویل"" دریافت شد فقط سیگنال های اکو بدرد نخور و پی در پی",،اطلاعاتي که دويل دريافت کرده بود وضعيت اوليه بوده که پيوسته پژواک پيدا ميکرده
74:28,74:31,"Oh, we are not prepared for this.",نه، آماده‌ی این نیستیم,نه، آماده‌ی این نیستیم,آه، ما چنين انتظاري نداشتيم,نه، آماده‌ی این نیستیم,.برای این مورد آماده نشده بودیم,ما آمادگی این رو نداریم,.اوه، واسه ي اين آماده نيستيم,آه، ما چنين انتظاري نداشتيم,ما براي اين آماده نيستيم,ما آمادگی این وضعیت رو نداریم,آه، ما چنين انتظاري نداشتيم
74:33,74:36,You eggheads have the survival skills of a Boy Scout troop.,شما کله‌خرها استعدادهای زنده موندن رو خوب بلدین,شما کله‌خرها استعدادهای زنده موندن رو خوب بلدین,شما متفکرها، مهارت‌هاي بقاتون در حد يه گروه پيشاهنگه,شما کله‌خرها استعدادهای زنده موندن رو خوب بلدین,شما کله‌پوکها مهارت .زنده موندن یه مشت پسربچه رو دارین,شما روشنفکرها مهارت‌های بقاءتون در حد یه گروه پسرای پیش‌آهنگ‌ـه,شما روشن فکرا مهارت زنده موندن اندازه ي .يه گروه پيش آهنگ رو دارين,شما متفکرها، مهارت‌هاي بقاتون در حد يه گروه پيشاهنگه,مهارت هاي بقاي شما دانشمندا در حد يه مشت بچه پيشاهنگه,مهارت های بقای شما عقل کل ها در حد گروه پیشاهنگ های مدرسه ست,شما متفکرها، مهارت‌هاي بقاتون در حد يه گروه پيشاهنگه
74:37,74:40,"Well, we got this far on our brains. Farther than any human in history.",،خب، ما تا این مرحله کار اومدیم فراتر از هر انسان دیگه‌ای در تاریخ,،خب، ما تا این مرحله کار اومدیم فراتر از هر انسان دیگه‌ای در تاریخ,،با همين مغزمون تا اينجا اومديم جايي که هيچ انساني در تاريخ نيومده,،خب، ما تا این مرحله کار اومدیم فراتر از هر انسان دیگه‌ای در تاریخ,.خب، تا اینجا به فکرمون می‌رسید .خیلی بیشتر از کل تاریخ بشریت بوده,،با همین مغزمون به اینجا رسیدیم جایی که هیچ انسانی در طول تاریخ نیومده,،خب ما با مغز خودمون تا اينجا اومديم .جلوتر از هر آدمي در طول تاريخ,،با همين مغزمون تا اينجا اومديم جايي که هيچ انساني در تاريخ نيومده,تا همينجا با مغزمون اومديم جايي که هيچ انساني تو تاريخ نيومده,، آره خب ، ما با هوشمون تا اینجا اومدیم آنقدر دور که تا حالا هیچ انسانی توی تاریخ پاشو اینجا نذاشته,،با همين مغزمون تا اينجا اومديم جايي که هيچ انساني در تاريخ نيومده
74:40,74:42,"Well, not far enough!",،اونقدرم فراتر نیست، حالا اینجا گیر کردیم ...تا وقتی که دیگه کسی,،اونقدرم فراتر نیست، حالا اینجا گیر کردیم ...تا وقتی که دیگه کسی,!خب، به اندازه‌ي کافي نيومديم,،اونقدرم فراتر نیست، حالا اینجا گیر کردیم ...تا وقتی که دیگه کسی,،خب به اندازه کافی نبوده ...و حالا اینجا گیر افتادیم تا وقتی که,!خب اونقدرها هم فراتر نبوده,خب به اندازه ي کافي دور نشديم. و الان هم اينجا گير کرديم ...تا زماني که هيچکي,!خب، به اندازه‌ي کافي نيومديم,!خوب، کافي نيست,خب این کافی نیست,!خب، به اندازه‌ي کافي نيومديم
74:42,74:45,And now we're stuck here till there won't be anyone left on Earth to save.,توی زمین باقی ‌نمی‌مونه,توی زمین باقی ‌نمی‌مونه,و حالا اينجا گير افتاديم تا زماني که ديگه هيچکس روي زمين باقي نميمونه تا نجاتش بديم,،اونقدرم فراتر نیست، حالا اینجا گیر کردیم ...تا وقتی که دیگه کسی,،خب به اندازه کافی نبوده ...و حالا اینجا گیر افتادیم تا وقتی که,حالا ما اینجا گیر کردیم اونم تا وقتی که دیگه هیچ انسانی برای نجات دادن روی زمین باقی نمونه,خب به اندازه ي کافي دور نشديم. و الان هم اينجا گير کرديم ...تا زماني که هيچکي,و حالا اينجا گير افتاديم تا زماني که ديگه هيچکس روي زمين باقي نميمونه تا نجاتش بديم,و تا وقتي اينجا گير مي کنيم که ديگه کسي رو زمين براي نجات دادن نمونده باشه,و الانم اینجا آنقدر گیر میکنیم که دیگه آدمی روی کره زمین باقی نمونه که ما بخواهیم نجاتش بدیم,و حالا اينجا گير افتاديم تا زماني که ديگه هيچکس روي زمين باقي نميمونه تا نجاتش بديم
74:48,74:51,"I'm counting every minute, same as you, Cooper.",منم مثل تو هر دقیقه رو می‌شمارم,منم مثل تو هر دقیقه رو می‌شمارم,منم مثل تو هر دقيقه‌اي که روي زمين مي‌گذره رو حساب ميکنم، کوپر,منم مثل تو هر دقیقه رو می‌شمارم,.منم مثل تو دقایق رو می‌شمرم,کوپر منم دارم مثل تو هر دقیقه ـش رو می‌شمارم و حساب می‌کنم,".""منم دارم مثل تو لحظه شماري ميکنم، ""کوپر",منم مثل تو هر دقيقه‌اي که روي زمين مي‌گذره رو حساب ميکنم، کوپر,منم مثله تو هر دقيقه رو ميشمرم کوپر,"منم مثل تو ""حساب هر دقیقه ای که میگذره رو دارم ، ""کوپر",منم مثل تو هر دقيقه‌اي که روي زمين مي‌گذره رو حساب ميکنم، کوپر
74:56,74:58,Is there any possibility...,هیچ راه‌حلی نداره؟ ...چه بدونم، یه راهی، نمیدونم,هیچ راه‌حلی نداره؟ ...چه بدونم، یه راهی، نمیدونم,...هيچ احتمالي هست,هیچ راه‌حلی نداره؟ ...چه بدونم، یه راهی، نمیدونم,هیچ احتمالی هست؟ ...میخوام بدونم، شاید راهی باشه، نمیدونم,...هیچ امکانی وجود نداره,...امکانش هست؟ نميدونم، شايد يه راهي، شايد ما,...هيچ احتمالي هست,... امکاني هست که,،هیچ راهی وجو نداره،، که نمیدونم ،، یجوری ،بتونیم احتمالا، هممون بریم به یه سیاه چاله و سال های رفته رو برگردونیم؟,...هيچ احتمالي هست
74:58,75:02,some kind of a way we can maybe all jump in a black hole?,شاید بتونیم بریم دورن سیاه‌چاله و چندین سالِ از دست رفته رو پس بگیریم؟,شاید بتونیم بریم دورن سیاه‌چاله و چندین سالِ از دست رفته رو پس بگیریم؟,...راهي باشه که ...مثلاً وارد يه سياه‌چاله بشيم,هیچ راه‌حلی نداره؟ ...چه بدونم، یه راهی، نمیدونم,،شاید بتونیم بریم داخل سیاهچاله تا سالهای از دست رفته رو برگردونیم؟,،چه می‌دونم، شاید یه راهی شاید بتونیم درون سیاهچاله بپریم؟,...امکانش هست؟ نميدونم، شايد يه راهي، شايد ما,...راهي باشه که ...مثلاً وارد يه سياه‌چاله بشيم,بتونيم بپريم توي سياهچاله؟,،هیچ راهی وجو نداره،، که نمیدونم ،، یجوری ،بتونیم احتمالا، هممون بریم به یه سیاه چاله و سال های رفته رو برگردونیم؟,...راهي باشه که ...مثلاً وارد يه سياه‌چاله بشيم
75:02,75:03,Gain back the years?,شاید بتونیم بریم دورن سیاه‌چاله و چندین سالِ از دست رفته رو پس بگیریم؟,شاید بتونیم بریم دورن سیاه‌چاله و چندین سالِ از دست رفته رو پس بگیریم؟,و اون سال‌هاي سپري شده رو برگردونيم؟,شاید بتونیم بریم دورن سیاه‌چاله و چندین سالِ از دست رفته رو پس بگیریم؟,،شاید بتونیم بریم داخل سیاهچاله تا سالهای از دست رفته رو برگردونیم؟,و بتونیم سال‌های گذشته رو پس بگیریم؟,بتونيم بپريم توي سياه چاله و چند سال به عقب برگرديم؟,و اون سال‌هاي سپري شده رو برگردونيم؟,سال هاي از دست رفته رو بگيريم؟,،هیچ راهی وجو نداره،، که نمیدونم ،، یجوری ،بتونیم احتمالا، هممون بریم به یه سیاه چاله و سال های رفته رو برگردونیم؟,و اون سال‌هاي سپري شده رو برگردونيم؟
75:04,75:06,Don't shake your head at me.,!سرتو اینجوری تکون نده - زمان نسبیه، خب -,!سرتو اینجوری تکون نده - زمان نسبیه، خب -,سرت رو برام تکون نده,!سرتو اینجوری تکون نده - زمان نسبیه، خب -,!سرت رو برام تکون نده - .زمان نسبیه، باشه -,!سرت رو اینجوری واسه من تکون نده,!سرتو واسه من تکون نده زمان، نسبيه، باشه؟,سرت رو برام تکون نده,سرت رو برام تکون نده,واسه من سر تکون نده,سرت رو برام تکون نده
75:06,75:08,"Time is relative, okay?",...میتونه گسترده بشه، متراکم بشه، ولی,...میتونه گسترده بشه، متراکم بشه، ولی,زمان، نسبيه. خب؟,!سرتو اینجوری تکون نده - زمان نسبیه، خب -,!سرت رو برام تکون نده - .زمان نسبیه، باشه -,زمان نسبی‌ـه، خب؟,!سرتو واسه من تکون نده زمان، نسبيه، باشه؟,زمان، نسبيه. خب؟,زمان نسبيه، باشه؟,زمان یه چیز نسبی هست ، خیلی خب؟,زمان، نسبيه. خب؟
75:08,75:11,"It can stretch and it can squeeze, but...",نمیتونه برگرده عقب، نمیشه,نمیتونه برگرده عقب، نمیشه,...ميتونه کش بياد و يا فشرده بشه، اما,...میتونه گسترده بشه، متراکم بشه، ولی,،میتونه کش بیاد ...می‌تونه فشرده بشه اما,...ممکنه امتداد پیدا کنه یا فشرده بشه ولی,...ميتونه کش بياد و فشرده بشه، ولي,...ميتونه کش بياد و يا فشرده بشه، اما,مي تونه بلغزه، مي تونه کش بياد ... ولي,... میتونه کش بیاد ، یا فشرده بشه ، ولی,...ميتونه کش بياد و يا فشرده بشه، اما
75:11,75:14,it can't run backwards. It just can't.,تنها چیزی که میتونه مثل زمان از ابعاد بگذره، گرانش هست,تنها چیزی که میتونه مثل زمان از ابعاد بگذره، گرانش هست,.نميتونه عقب بره نميتونه,نمیتونه برگرده عقب، نمیشه,!نمیتونه به عقب برگرده .امکانش نیست,!نمی‌تونه به عقب برگرده !نمیشه دیگه,!نميتونه به عقب برگرده !نميشه,.نميتونه عقب بره نميتونه,نمي تونه به عقب برگرده، فقط نمي تونه,نمیتونه به عقب برگرده ، نمیشه ...,.نميتونه عقب بره نميتونه
75:14,75:18,"The only thing that can move across dimensions, like time, is gravity.",تنها چیزی که میتونه مثل زمان از ابعاد بگذره، گرانش هست,تنها چیزی که میتونه مثل زمان از ابعاد بگذره، گرانش هست,تنها چيزي که ميتونه مثل زمان، بين بعدها حرکت کنه گرانشه,تنها چیزی که میتونه مثل زمان از ابعاد بگذره، گرانش هست,تنها چیزی که میتونه مثل زمان .در طول ابعاد حرکت کنه، جاذبه‌ست,تنها چیزی که مثل زمان می‌تونه از بین .بعدهای مختلف عبور بکنه، گرانش‌ـه,.تنها چيزي که ميتونه از بعد ها عبور کنه، جاذبه‌اس,تنها چيزي که ميتونه مثل زمان، بين بعدها حرکت کنه گرانشه,تنها چيزي که مثله زمان ميتونه بين بعد ها حرکت کنه جاذبس,"، تنها چیزی که میتونه مثل زمان در میان ابعاد حرکت کنه گرانش"" هست""",تنها چيزي که ميتونه مثل زمان، بين بعدها حرکت کنه گرانشه
75:21,75:22,Okay.,,,بسيار خب,باشه,.باشه,خیلی‌خب,.باشه,بسيار خب,باشه,خیلی خب,بسيار خب
75:24,75:28,"The beings that led us here, they communicate...",اونا میتونن از طریق گرانش ارتباط برقرار کنن، درسته؟,اونا میتونن از طریق گرانش ارتباط برقرار کنن، درسته؟,اون موجوداتي که ما رو به اينجا راهنمايي کردن ...از طريق گرانش,،گونه‌هایی که ما رو اینجا هدایت کردن,موجوداتی که ما رو ...به اینجا راهنمایی کردن,،موجوداتی که ما رو به اینجا هدایت کردند ...اونا توسط,،هستي ما رو به اينجا کشونده,اون موجوداتي که ما رو به اينجا راهنمايي کردن ...از طريق گرانش,موجوداتي که ما رو به اينجا کشوندن ... مثل همون دست دادن. اونا ميتونن,"موجوداتی که ما رو به اینجا کشوندن - از طریق ""گرانش"" ارتباط برقرار کردن،درسته ؟ بله -",اون موجوداتي که ما رو به اينجا راهنمايي کردن ...از طريق گرانش
75:28,75:30,"- through gravity, right? - Yes.",ممکنه از آینده با ما صحبت کرده باشن؟,ممکنه از آینده با ما صحبت کرده باشن؟,با ما ارتباط برقرار کردن، درسته؟ - بله -,اونا میتونن از طریق گرانش ارتباط برقرار کنن، درسته؟,از راه جاذبه با ما ارتباط برقرار کردن، درسته؟,گرانش ارتباط برقرار میکنن، درسته؟ - درسته -,از طريق جاذبه ارتباط برقرار ميکنن، درسته؟,با ما ارتباط برقرار کردن، درسته؟ - بله -,از جاذبه استفاده کنن، درسته؟ - بله -,"موجوداتی که ما رو به اینجا کشوندن - از طریق ""گرانش"" ارتباط برقرار کردن،درسته ؟ بله -",با ما ارتباط برقرار کردن، درسته؟ - بله -
75:30,75:32,Could they be talking to us from the future?,ممکنه از آینده با ما صحبت کرده باشن؟,ممکنه از آینده با ما صحبت کرده باشن؟,ممکنه که از زمان آينده با ما صحبت ميکردن؟,ممکنه از آینده با ما صحبت کرده باشن؟,امکانش هست که دارن از آینده باهامون صحبت می‌کنن؟,میشه از آینده با ما صحبت کرده باشن؟,ميتونن از آينده باهامون حرف بزنن؟ - .شايد -,ممکنه که از زمان آينده با ما صحبت ميکردن؟,ممکنه از آينده با ما صحبت کنن؟,احتمالش هست که از آینده با ما صحبت کرده باشن ؟,ممکنه که از زمان آينده با ما صحبت ميکردن؟
75:33,75:35,- Maybe. - Okay. If they can...,...خیلی‌خب، اگه اونا میتونن - ...اونا -,...خیلی‌خب، اگه اونا میتونن - ...اونا -,شايد - ...بسيار خب، اگه اونا بتونن -,...خیلی‌خب، اگه اونا میتونن - ...اونا -,خیله خب، اگر اونا بتونن...؟ - ...اونا -,شاید - خیلی‌خب، پس اگه اونا میتونن...؟ -,باشه، اگه بتونن...؟ ...اونا -,شايد - ...بسيار خب، اگه اونا بتونن -,شايد - ... باشه، اگه بتونن -,"شاید - --خیلی خب ، اگه ""آنها"" بتونن -",شايد - ...بسيار خب، اگه اونا بتونن -
75:37,75:40,"""They"" are beings of five dimensions.",گونه‌هایی بیگانه از فضای 5 بُعدی هستن,گونه‌هایی بیگانه از فضای 5 بُعدی هستن,"!اونا"" موجودات داراي 5 بعد هستن""",گونه‌هایی بیگانه از فضای 5 بُعدی هستن,.از 5 بُـعد هستن,!اونا موجوداتی از فضای پنج بُعدی‌ان,!به معني بودن 5 بعده,"!اونا"" موجودات داراي 5 بعد هستن""",اونا موجوداتي با پنج بعد هستن,"آنها"" موجوداتی هستند دارای 5 بعد""","!اونا"" موجودات داراي 5 بعد هستن"""
75:40,75:44,"To them, time might be another physical dimension.",زمان، میتونه برای اونا شبیه بُعدی فیزیکی جلوه بده,زمان، میتونه برای اونا شبیه بُعدی فیزیکی جلوه بده,خب، براي اونا، زمان ممکنه فقط يه بعد فيزيکي ديگه باشه,زمان، میتونه برای اونا شبیه بُعدی فیزیکی جلوه بده,درسته برای اونا .شاید زمان یک بُـعد فیزیکی دیگه باشه,برای اونا زمان ممکنه یه بُعد فیزیکی دیگه باشه,.باشه، براي اونا، زمان شايد بعد طبيعي ديگشون باشه,خب، براي اونا، زمان ممکنه فقط يه بعد فيزيکي ديگه باشه,براي اونا زمان ممکنه يه بعد فيزيکي باشه,"برای ""آنها"" ، زمان میتونه مثل یک بعد فیزیکی دیگه باشه",خب، براي اونا، زمان ممکنه فقط يه بعد فيزيکي ديگه باشه
75:44,75:45,To them...,گذشته، ممکنه برای اونا شبیه ،غاری باشه که بتونن برن توش,گذشته، ممکنه برای اونا شبیه ،غاری باشه که بتونن برن توش,...براي اونا,گذشته، ممکنه برای اونا شبیه ،غاری باشه که بتونن برن توش,برای اونا شاید گذشته ...یه دره باشه که بتونن ازش پایین برن,...برای اونا,براي اونا، گذشته ميتونه دره اي باشه که از روش ،بالا بيان,...براي اونا,... براي اونا,"... ""برای ""آنها",...براي اونا
75:46,75:50,the past might be a canyon that they can climb into and the future...,،و آینده، شبیه کوهیه که میتونن برن بالا !ولی برای ما اینطور نیست، خب,،و آینده، شبیه کوهیه که میتونن برن بالا !ولی برای ما اینطور نیست، خب,گذشته ممکنه مثل دره‌اي باشه ...که ازش پايين برن و آينده,گذشته، ممکنه برای اونا شبیه ،غاری باشه که بتونن برن توش,برای اونا شاید گذشته ...یه دره باشه که بتونن ازش پایین برن,گذشته ممکنه مثل یه دره‌‌ی ...باریکی باشه که می‌تونن ازش پایین برن و آینده,براي اونا، گذشته ميتونه دره اي باشه که از روش ،بالا بيان,گذشته ممکنه مثل دره‌اي باشه ...که ازش پايين برن و آينده,گذشته مي تونه مثله يه دره اي باشه که ... ازش بالا بيان و به آينده برسن,گذشته میتونه مثل دره ای باشه ... ... که ازش میگذرن ، و آینده,گذشته ممکنه مثل دره‌اي باشه ...که ازش پايين برن و آينده
75:50,75:53,"a mountain they can climb up. But to us, it's not, okay?",،و آینده، شبیه کوهیه که میتونن برن بالا !ولی برای ما اینطور نیست، خب,،و آینده، شبیه کوهیه که میتونن برن بالا !ولی برای ما اینطور نیست، خب,مثل کوهي باشه که ميتونن ازش بالا برن اما براي ما نه، خب؟,،و آینده، شبیه کوهیه که میتونن برن بالا !ولی برای ما اینطور نیست، خب,ولی واسه ما همچین چیزی ممکن نیست، باشه؟,مثل یه کوهی باشه که می‌تونن ازش بالا برن ولی برای ما اینجوری نیست! خب؟,،و آينده، کوه هايي که ميتونن بالا بيان ولي واسه ما نيست، باشه؟,مثل کوهي باشه که ميتونن ازش بالا برن اما براي ما نه، خب؟,يه کوه که بتونن ازش بالا برن ولي براي ما اينجوري نيست، باشه؟,میتونه مثل کوهی باشه که بهش صعود میکنن ... ولی برای ما اینطور نیست ، خیلی خب ؟,مثل کوهي باشه که ميتونن ازش بالا برن اما براي ما نه، خب؟
