Start Time,End Time,English,Interstellar 2014 DVDScr FaSub Remington[Edited].srt,Interstellar 2014 HQ DVDScr FaSub Remington.srt,Interstellar 2014.srt,Interstellar BluRay 1080p 720p Fa.Remington.srt,Interstellar-2014-720p_IMDB-DL.Com.srt,Interstellar.2014.720p.BluRay.x264-DAA.srt,Interstellar.2014.ALL.BLURAY.9Movie.WorldSubtitle.srt,Interstellar.2014.BluRay.1080p.720p.Fa.srt,Interstellar.2014.BluRay.NightMovie.srt,Interstellar1080farsi.srt,persian1.srt
34:34,34:39,The problem is gravity. How to get a viable amount of human life off the planet.,چطور بتونیم انبوهی از بشریت زیست‌پذیر رو از سیاره ببریم بیرون؟,چطور بتونیم انبوهی از بشریت زیست‌پذیر رو از سیاره ببریم بیرون؟,مشکل گرانشه. چطور بايد تعدادي زنده موندني از انسان‌ها رو از کره‌ي زمين خارج کنيم؟,چطور بتونیم انبوهی از بشریت زیست‌پذیر رو از سیاره ببریم بیرون؟,،مشکل جاذبه‌س ... چطوری میزان مشخص و زیست‌پذیری,‏مشکل گرانش‌ـه. ‏چطور تعدادی از انسان‌ها رو از سیاره‌ی زمین ‏خارج کنیم که زنده بمونن؟,مسئله جاذبه است,مشکل گرانشه. چطور بايد تعدادي زنده موندني از انسان‌ها رو از کره‌ي زمين خارج کنيم؟,مشکلِ ما جاذبه‌ست. اينکه طوري بتونيم تعداد زيادي از مردم رو از زمين خارج کنيم,"چجوری مقدار قابل قبولی از ""زندگی انسانی"" رو از اینجا ببریم ؟",مشکل گرانشه. چطور بايد تعدادي زنده موندني از انسان‌ها رو از کره‌ي زمين خارج کنيم؟
34:39,34:40,This is one way.,B این تنها راهشه. نقشه انفجار جمعیت,B این تنها راهشه. نقشه انفجار جمعیت,يه راهش اينه,چطور بتونیم انبوهی از بشریت زیست‌پذیر رو از سیاره ببریم بیرون؟,.این یه راهشه,‏این یه راهشه,چطور میشه به مقدار زندگی قابل دوام انسان بیرون از سیاره رسید؟,يه راهش اينه,...از اين روش امکان‌پذيره,این یه راهشه,يه راهش اينه
34:40,34:43,Plan B: A population bomb.,بیش از 5000 تخم آبسته سنجیده شده با جِرم کمتر از 900 کیلو,بیش از 5000 تخم آبسته سنجیده شده با جِرم کمتر از 900 کیلو,"نقشه‌ي ""ب"": بمب جمعيت",B این تنها راهشه. نقشه انفجار جمعیت,"،""طرح ""ب .بمب جمعیتی",نقشه‌ی ب، بمب جمعیت,B این یه راهه. نقشه ی مخزن جمعیت,"نقشه‌ي ""ب"": بمب جمعيت",.نقشه‌ي جايگزين؛ بمب جمعيتـي,"نقشه ""ب"" : بمب جمعیت","نقشه‌ي ""ب"": بمب جمعيت"
34:43,34:48,"Over 5,000 fertilized eggs weighing in at just under 900 kilos.",بیش از 5000 تخم آبسته سنجیده شده با جِرم کمتر از 900 کیلو,بیش از 5000 تخم آبسته سنجیده شده با جِرم کمتر از 900 کیلو,بيش از 5000 تخم بارور که زير 900 کيلوگرم وزن دارن,بیش از 5000 تخم آبسته سنجیده شده با جِرم کمتر از 900 کیلو,بیشتر از 5000 ...تخمک بارور شده داریم,‏بیشتر از 5000 تخم بارور شده ‏که کمتر از 900 کیلو وزن دارن,بیشتر از 5000 تخم بارور شده زیر 900 کیلو سنجش شده,بيش از 5000 تخم بارور که زير 900 کيلوگرم وزن دارن,بالاي 5هزار تخمِ بارورشده که .مجموعاً کمتر از 900کيلو وزن دارن,بیشتر از 5000 تخمک بارور که کلا  زیر 900 کیلو وزن دارن,بيش از 5000 تخم بارور که زير 900 کيلوگرم وزن دارن
34:49,34:50,How would you raise them?,با ابزارهای پیشرفته ما 10تای اولی رو تکوین کردیم,با ابزارهای پیشرفته ما 10تای اولی رو تکوین کردیم,چطوري بزرگشون مي‌کنين؟,چطوری اینا رو پرورش میدی؟,چطوری می‌خوای پرورششون بدی؟,چطور پرورششون میدین؟,چطور بزرگشون می کنین؟ - با تجهیزات بیرون 10 تای اول رو جوجه کشی می کنیم -,چطوري بزرگشون مي‌کنين؟,چطوري عمل ميکنه؟,چطوری زیادشون میکنید ؟,چطوري بزرگشون مي‌کنين؟
34:50,34:53,"With equipment on board, we incubate the first 10.",بعدش، با رحم اجاره‌ای بازه‌ی رشد سریع‌تر میشه,بعدش، با رحم اجاره‌ای بازه‌ی رشد سریع‌تر میشه,با تجهيزاتي که مي‌بريم ده تاي اول رو پرورش ميديم,با ابزارهای پیشرفته ما 10تای اولی رو تکوین کردیم,با تجهیزاتی که همراهمون داریم 10تای  .اول رو پرورش میدیم، و به نتیجه می‌رسونیم,با تجهیزاتی که می‌بریم ده تای اول رو پرورش میدیم,چطور بزرگشون می کنین؟ - با تجهیزات بیرون 10 تای اول رو جوجه کشی می کنیم -,با تجهيزاتي که مي‌بريم ده تاي اول رو پرورش ميديم,،با تجهيزاتي که توي فضاپيما داريم 10تخم رو رشد ميديم,با تجهیزاتی که داریم  10 تای اول رو به عمل میاریم,با تجهيزاتي که مي‌بريم ده تاي اول رو پرورش ميديم
34:53,34:57,"After that, with surrogacy, the growth becomes exponential.",بعدش، با رحم اجاره‌ای بازه‌ی رشد سریع‌تر میشه,بعدش، با رحم اجاره‌ای بازه‌ی رشد سریع‌تر میشه,بعد از اون، با استفاده از رحم جايگزين رشد تصاعدي ميشه,بعدش، با رحم اجاره‌ای بازه‌ی رشد سریع‌تر میشه,رشدشون بصورت تصاعدی .صورت میگیره,‏بعد از اون، با رحم جایگزین ‏رشد نمایی میشه,بعد از اون، با رحم جایگزین رشد تعریفی میشه,بعد از اون، با استفاده از رحم جايگزين رشد تصاعدي ميشه,،بعد از اون، با استفاده از رحم جايگزين رشد ميتونه سريعـتر صورت بگيره,"""بعدش ، با روش ""رحم جایگزین رشد تصاعدی خواهیم داشت",بعد از اون، با استفاده از رحم جايگزين رشد تصاعدي ميشه
34:58,35:01,"Within 30 years, we could have a colony of hundreds.",مشکل اساسی در استعمار تنوع ژنتیکی هست,مشکل اساسی در استعمار تنوع ژنتیکی هست,،بعد در عرض 30 سال ميتونيم يه مجموعه‌ي چندصدتايي داشته باشيم,در عرضِ 30 سال، میتونیم صدها مستعمره داشته باشیم,بعد از 30 سال می‌تونیم یه .کلنی چند صدتایی داشته باشیم,‏در عرض 30 سال، می‌تونیم یه کُلونی از ‏صدها تخم داشته باشیم,درعرض 30 سال، یه کلنی از صدها داریم,،بعد در عرض 30 سال ميتونيم يه مجموعه‌ي چندصدتايي داشته باشيم,،در عرض 30سال .ميتونيم يه مستعمره‌ي چند صد نفره داشته باشيم,، در عرض 30 سال  یه اجتماع چند صد نفری داریم,،بعد در عرض 30 سال ميتونيم يه مجموعه‌ي چندصدتايي داشته باشيم
35:01,35:04,The real difficulty with colonization is genetic diversity.,مشکل اساسی در استعمار تنوع ژنتیکی هست,مشکل اساسی در استعمار تنوع ژنتیکی هست,تنوع ژنتيکي، مانع اصلي تشکيل کلوني هست,مشکل اساسی در استعمار تنوع ژنتیکی هست,،سختیِ اصلیِ کلنی شدن و مسکن گزیدن .تفاوت ژنتیکیـه,‏تنها مشکل جدی در تشکیل کلونی ‏تنوع ژنتیکی‌ـه,سختی واقعی توی مهاجرت، تنوع گونه هاست,تنوع ژنتيکي، مانع اصلي تشکيل کلوني هست,تنها مشکلي که با ايجاد يه محيط .زندگي داريم، تنوعِ ژنتيک‌هاست,(بیشترین سختی این نوع مهاجرت (کلون سازی تنوع ژنتیکی هست,تنوع ژنتيکي، مانع اصلي تشکيل کلوني هست
35:05,35:07,This takes care of that.,آره، ولی آدمای اینجا چی میشن؟ میخوای همین‌جوری بیخیال جماعت بشیم؟,آره، ولی آدمای اینجا چی میشن؟ میخوای همین‌جوری بیخیال جماعت بشیم؟,اين ترتيب اين کار رو ميده,این مشکل رو حل میکنه,.که این حلش میکنه,‏این ترتیبش رو میده,این ترتیبش رو میده,اين ترتيب اين کار رو ميده,که اين مشکل هم حل ميشه,دقت زیادی میخواد,اين ترتيب اين کار رو ميده
35:07,35:09,But what about the people here? You just...,آره، ولی آدمای اینجا چی میشن؟ میخوای همین‌جوری بیخیال جماعت بشیم؟,آره، ولی آدمای اینجا چی میشن؟ میخوای همین‌جوری بیخیال جماعت بشیم؟,آره، ولي مردمي که اينجا هستن چي؟ همين طوري، ازشون قطع اميد ميکنين؟,آره، ولی آدمای اینجا چی میشن؟ میخوای همین‌جوری بیخیال جماعت بشیم؟,مردم اینجا چی میشن؟,‏آره ولی آدمایی که اینجا هستن چی؟ ...‏از اونا,آره، اما مردم اینجا چی؟ همینجوری می خواین بیخیالشون بشین؟,آره، ولي مردمي که اينجا هستن چي؟ همين طوري، ازشون قطع اميد ميکنين؟,...پس مردمـي که اينجا زندگي ميکنن چطور؟ همينطوري,ولی آدمای اینجا چی ؟,آره، ولي مردمي که اينجا هستن چي؟ همين طوري، ازشون قطع اميد ميکنين؟
35:10,35:11,give up on them?,بچه‌های من؟,بچه‌های من؟,آره، ولي مردمي که اينجا هستن چي؟ همين طوري، ازشون قطع اميد ميکنين؟,آره، ولی آدمای اینجا چی میشن؟ میخوای همین‌جوری بیخیال جماعت بشیم؟,همینطوری بیخیالشون میشید؟ بچه‌هام؟,قطع امید می‌کنین؟ بچه‌هام؟,آره، اما مردم اینجا چی؟ همینجوری می خواین بیخیالشون بشین؟,آره، ولي مردمي که اينجا هستن چي؟ همين طوري، ازشون قطع اميد ميکنين؟,ميخواين رهاشـون کنين؟,بیخیالشون میشین ؟,آره، ولي مردمي که اينجا هستن چي؟ همين طوري، ازشون قطع اميد ميکنين؟
35:11,35:13,My kids?,باحال‌تره  A واسه همین نقشه,باحال‌تره A واسه همین نقشه,از بچه‌هام؟,بچه‌های من؟,همینطوری بیخیالشون میشید؟ بچه‌هام؟,قطع امید می‌کنین؟ بچه‌هام؟,بچه های من؟ - خیلی سرگردم کننده تره  A بخاطر اینه که نقشه ی -,از بچه‌هام؟,مثلاً بچه‌هاي من؟,بچه من ؟,از بچه‌هام؟
35:13,35:17,That's why Plan A is a lot more fun.,باحال‌تره  A واسه همین نقشه,باحال‌تره A واسه همین نقشه,"بهمين خاطر نقشه ""آ"" خيلي باحال‌تره",باحال‌تره A واسه همین نقشه,"به خاطر همین .طرح ""الف"" خیلی بهتره",برای همینه که نقشه‌ی الف خیلی باحال‌تره,بچه های من؟ - خیلی سرگردم کننده تره  A بخاطر اینه که نقشه ی -,"بهمين خاطر نقشه ""آ"" خيلي باحال‌تره",.براي همين نقشه‌ي اصلي خيلي جالبـتره,"واسه همینه که نقشه ""الف"" خیلی باحالتره","بهمين خاطر نقشه ""آ"" خيلي باحال‌تره"
35:19,35:22,- How far have you got? - Almost there.,تا چه حد پیش رفتی؟ - تقریباً تمومه -,تا چه حد پیش رفتی؟ - تقریباً تمومه -,چقدر مونده که حلش کني؟ - نزديکم -,تا چه حد پیش رفتی؟ - تقریباً تمومه -,چقدر پیش رفتی؟ - .دیگه آخراشه -,‏- چقدر پیش رفتین؟ ‏- تقریباً آخراشه,چقدر پیش رفتین؟ - تقریبا رسیدیم -,چقدر مونده که حلش کني؟ - نزديکم -,تا چقدر از نقشه پيش رفتي؟ - تقريباً نزديک شدم -,چقدر مونده که حلش کنی ؟ - تقریبا چیزی نمونده,چقدر مونده که حلش کني؟ - نزديکم -
35:22,35:24,You're asking me to hang everything...,...ازم میخوای که تمام دار و ندارم روی,...ازم میخوای که تمام دار و ندارم روی,...ازم مي‌خواي همه چيز رو ول کنم و برم,...ازم میخوای که تمام دار و ندارم روی,ازم می‌خوای بیخیال همه چی بشم ...و برم اون بالا,...‏داری ازم می‌خوای همه‌چی رو به خطر بندازم,ازم می خوای همه چیزو بذارم,...ازم مي‌خواي همه چيز رو ول کنم و برم,...يعني ازم ميخواي که فقط براي,... تو ازم میخوای بیخیال همه چیزم بشم,...ازم مي‌خواي همه چيز رو ول کنم و برم
35:25,35:27,on an almost.,"تقریباً"" شرط‌بندی کنم؟"" - ازت میخوام که بهم اعتماد کنی -","تقریباً"" شرط‌بندی کنم؟"" - ازت میخوام که بهم اعتماد کنی -","به اميد يه ""نزديکم""؟","تقریباً"" شرط‌بندی کنم؟"" - ازت میخوام که بهم اعتماد کنی -",درحالیکه صد در صد نتیجه نگرفتی؟,"""اونم براساس ""تقریباً","رو یه ""تقریبا"" ؟ - ازت می خوام بهم اعتماد کنی -","به اميد يه ""نزديکم""؟","تقريباً""، همه‌چيزم رو رها کنم؟""",... بخاطر یه تقریبا,"به اميد يه ""نزديکم""؟"
35:27,35:30,I'm asking you to trust me.,"تقریباً"" شرط‌بندی کنم؟"" - ازت میخوام که بهم اعتماد کنی -","تقریباً"" شرط‌بندی کنم؟"" - ازت میخوام که بهم اعتماد کنی -",ازت مي‌خوام بهم اعتماد کني,"تقریباً"" شرط‌بندی کنم؟"" - ازت میخوام که بهم اعتماد کنی -",.ازت می‌خوام بهم اعتماد کنی,ازت می‌خوام که بهم اعتماد کنی,"رو یه ""تقریبا"" ؟ - ازت می خوام بهم اعتماد کنی -",ازت مي‌خوام بهم اعتماد کني,ازت ميخوام که بهم اعتماد کني,من ازت میخوام بهم اعتماد کنی,ازت مي‌خوام بهم اعتماد کني
35:31,35:32,(SIGHS),خونه جدیدی برا ما پیدا کن,خونه جدیدی برا ما پیدا کن,,,,,یه خونه جدید واسمون پیدا کنی,,,,
35:33,35:34,Find us a new home.,...و وقتی برگشتی، من مشکل گرانش رو,...و وقتی برگشتی، من مشکل گرانش رو,يه خونه‌ي جديد برامون پيدا کن,خونه جدیدی برا ما پیدا کن,.یه خونه‌ی جدید برامون پیدا کن,‏یه خونه‌ی جدید برامون پیدا کن,یه خونه جدید واسمون پیدا کنی,يه خونه‌ي جديد برامون پيدا کن,دنبال يه محل زندگيِ جديد براي ما باشي,یه خونه جدید برامون پیدا کن,يه خونه‌ي جديد برامون پيدا کن
35:35,35:37,And by the time you return...,...و وقتی برگشتی، من مشکل گرانش رو,...و وقتی برگشتی، من مشکل گرانش رو,تا وقتي که برگردي من مشکل گرانش رو حل کردم,...و وقتی برگشتی، من مشکل گرانش رو,...و زمانی که برگردی من این مشکل,...‏و تا زمانی که برگردی,،و تا وقتی که داری برمی گردی من مشکل جاذبه رو,تا وقتي که برگردي من مشکل گرانش رو حل کردم,...و زماني که برگشتي,... و تا وقتی که تو برگردی,تا وقتي که برگردي من مشکل گرانش رو حل کردم
35:38,35:40,I will have solved the problem of gravity.,برطرف میکنم. بهت قول میدم,برطرف میکنم. بهت قول میدم,تا وقتي که برگردي من مشکل گرانش رو حل کردم,...و وقتی برگشتی، من مشکل گرانش رو,.جاذبه رو حل کردم,‏من مشکل گرانش رو ‏حل کردم,،و تا وقتی که داری برمی گردی من مشکل جاذبه رو,تا وقتي که برگردي من مشکل گرانش رو حل کردم,من ديگه مشکل جاذبه رو حل ميکنم,"منم مشکل ""گرانش"" رو حل کردم",تا وقتي که برگردي من مشکل گرانش رو حل کردم
35:41,35:43,I give you my word.,,,بهت قول ميدم,برطرف میکنم. بهت قول میدم,.حرفم حرفـه,‏بهت قول میدم,حل کردم بهت قول میدم,بهت قول ميدم,بهت اين قول رو ميدم,بهت قول میدم,بهت قول ميدم
35:55,35:57,MURPH: Go away!,,,!گم شو,!برو,!برو,!‏برو گمشو,!برو,!گم شو,!نميخوام ببينمت,برو گمشو,!گم شو
36:08,36:09,Murph.,!برو. اگه میخوای ترک کنی، برو,!برو. اگه میخوای ترک کنی، برو,مورف,مورف,".""مورف""",مورف,"""مرف"" - !برو. اگه داری میری پس برو -",مورف,مورف,مورف,مورف
36:09,36:12,"MURPH: Go! If you're leaving, just go.",!برو. اگه میخوای ترک کنی، برو,!برو. اگه میخوای ترک کنی، برو,برو! اگه ميخواي بري، فقط برو,!برو. اگه میخوای ترک کنی، برو,،اگه می‌خوای ما رو ترک کنی .برو نمی‌خوام ببینمت,برو. اگه داری میری، برو دیگه,"""مرف"" - !برو. اگه داری میری پس برو -",برو! اگه ميخواي بري، فقط برو,برو! اگه ميخواي بري، پس فقط برو,! برو ! اگه میخوای بری برو دیگه,برو! اگه ميخواي بري، فقط برو
36:15,36:18,"DONALD: This world was never enough for you, was it, Coop?",این دنیا برات کافی نیست، مگه نه کوپر؟,این دنیا برات کافی نیست، مگه نه کوپر؟,اين دنيا هيچوقت برات کافي نبود، نه، کوپ؟,این دنیا برات کافی نیست، مگه نه کوپر؟,"،این دنیا هیچوقت واست کافی نبود مگه نه ""کوپ""؟",‏این دنیا هیچوقت برات کافی نبود، نه کوپ؟,"این دنیا هیچ وقت واست کافی نبود، نه ""کوپر""؟",اين دنيا هيچوقت برات کافي نبود، نه، کوپ؟,اين دنيا به تنهايي هيچوقت براي تو کافي نبود، مگه نه کوپ؟,"، این زمین هیچوقت برای تو کافی نبوده درست نمیگم  ""کوپ"" ؟",اين دنيا هيچوقت برات کافي نبود، نه، کوپ؟
36:19,36:22,"What, because heading out there is what I feel like I was born to do?",چی، یعنی وقتی بخوام برم اونجا دلیل میشه احساس کنم که ذاتاً این کاره‌ام؟,چی، یعنی وقتی بخوام برم اونجا دلیل میشه احساس کنم که ذاتاً این کاره‌ام؟,يعني چون احساس ميکنم زاده شدم ...که به فضا برم,چی، یعنی وقتی بخوام برم اونجا دلیل میشه احساس کنم که ذاتاً این کاره‌ام؟,چیه، چون رفتن به اون بالا چیزیه که احساس می‌کنم واسش زاده شدم؟,‏چون احساس می‌کنم به فضا رفتن ...‏چیزیه که براش زاده شدم,چی، چون بیرون زدن ازینجا حسی میده که انگاری واسش متولد شدم؟,يعني چون احساس ميکنم زاده شدم ...که به فضا برم,،چيه؟ چون ميخوام اينکارو بکنم يعني حس ميکنم براي همينکار متولد شدم؟,، چرا؟ چون ترک کردن این سیاره کاریه که حس میکنم به خاطرش به دنیا اومدم؟,يعني چون احساس ميکنم زاده شدم ...که به فضا برم
36:23,36:25,And it excites me? Heh.,نه اصلاًم اینطوری نیست,نه اصلاًم اینطوری نیست,و اين هيجان‌زده‌م ميکنه؟,یعنی منو شگفت زده میکنه؟,و منو هیجان زده می‌کنه؟,‏و هیجان‌زده‌م می‌کنه؟,و تحریکم می کنه؟,و اين هيجان‌زده‌م ميکنه؟,و اينکه منـو به وجد مياره؟,و باعث میشه به شوق بیام ؟,و اين هيجان‌زده‌م ميکنه؟
36:26,36:28,"No, that does not make it wrong.",شایدم اینطوره,شایدم اینطوره,نه، اين دليل نميشه که کار اشتباهي باشه,نه اصلاًم اینطوری نیست,.نه، خرابش نمی‌کنه,نه، این باعث نمیشه که کار غلطی باشه,نه، این اشتباهش نمی کنه - شاید -,نه، اين دليل نميشه که کار اشتباهي باشه,نه، باز اصل قضيه زير سؤال نميره,نه ، این ها دلیل نمیشه که این کار غلط باشه,نه، اين دليل نميشه که کار اشتباهي باشه
36:28,36:30,It might.,به چیزی که درسته بابت نتیجه‌ی اشتباهش اعتماد نکن,به چیزی که درسته بابت نتیجه‌ی اشتباهش اعتماد نکن,ممکنه باشه,شایدم اینطوره,،شاید بکنه,ممکنه باشه. ‏به کاری درستی که به دلیل اشتباهی انجام میشه اعتماد نکن,نه، این اشتباهش نمی کنه - شاید -,ممکنه باشه,ممکنـه,ممکنه,ممکنه باشه
36:30,36:33,Don't trust the right thing done for the wrong reason.,به چیزی که درسته بابت نتیجه‌ی اشتباهش اعتماد نکن,به چیزی که درسته بابت نتیجه‌ی اشتباهش اعتماد نکن,به کار درستي که بخاطر يه هدف غلط انجام ميشه، اعتماد نکن,به چیزی که درسته بابت نتیجه‌ی اشتباهش اعتماد نکن,به کار درستی که برای .دلیلی اشتباه انجام میشه، اعتماد نکن,ممکنه باشه. ‏به کاری درستی که به دلیل اشتباهی انجام میشه اعتماد نکن,به کارهای درستی که واسه اهداف اشتباه انجام شدن اعتماد نکن,به کار درستي که بخاطر يه هدف غلط انجام ميشه، اعتماد نکن,به يه کارِ درست براي يه هدف اشتباه، اطمينان نکن,ولی به کار درستی که بخاطر دلایل غلط انجام میشه اعتماد نکن,به کار درستي که بخاطر يه هدف غلط انجام ميشه، اعتماد نکن
36:34,36:36,"The why of the thing, that's the foundation.","بنیان همه چیز ""چرا"" هست","بنیان همه چیز ""چرا"" هست",چراي انجام کار، اساس کار اينه,"بنیان همه چیز ""چرا"" هست",".چرا""ی کار، اساس موضوعـه""",دلیل انجام کار، پایه و اساس کارــه,"چرا""ی هرچیزی، اساسشه"" - و اساس قابل اطمینان ـه -",چراي انجام کار، اساس کار اينه,دليلِ انجام يه کاري، از همه‌چيز مهمـتره,چیزی که مهمه ، دلایله,چراي انجام کار، اساس کار اينه
36:36,36:38,And the foundation's solid.,و بنیان استوار و لمس کردنیه,و بنیان استوار و لمس کردنیه,خب، اساس کار محکمه,و بنیان استوار و لمس کردنیه,پایه و اساس موضوع .مشخص و عالیه,پایه و اساسش محکمه,"چرا""ی هرچیزی، اساسشه"" - و اساس قابل اطمینان ـه -",خب، اساس کار محکمه,که دليلِ خيلي محکمـي هم داره,و دلایل من محکم هستن,خب، اساس کار محکمه
