Start Time,End Time,English,Interstellar 2014 DVDScr FaSub Remington[Edited].srt,Interstellar 2014 HQ DVDScr FaSub Remington.srt,Interstellar 2014.srt,Interstellar BluRay 1080p 720p Fa.Remington.srt,Interstellar-2014-720p_IMDB-DL.Com.srt,Interstellar.2014.720p.BluRay.x264-DAA.srt,Interstellar.2014.ALL.BLURAY.9Movie.WorldSubtitle.srt,Interstellar.2014.BluRay.1080p.720p.Fa.srt,Interstellar.2014.BluRay.NightMovie.srt,Interstellar1080farsi.srt,persian1.srt
107:24,107:25,Your cue light's broken.,شوخی نمی‌کنم,شوخی نمی‌کنم,چراغ نشانه‌‌ي شوخ طبعي‌ات خراب شده,چراغت داره چشمک میزنه,.باید هرچی میگی رو انجام بدم - .چراغ راهنمات داره چشمک میزنه -,چراغت خراب شده - !شوخی نمی‌کنم -,.باید هرکاری میگی بکنم - .چراغت داره چشمک میزنه -,چراغ نشانه‌‌ي شوخ طبعي‌ات خراب شده,!چراغ نشانگر شوخ طبعيت خراب شده,چراغ راهنمای شوخیت خاموشه - شوخی نمیکنم -,چراغ نشانه‌‌ي شوخ طبعي‌ات خراب شده
107:25,107:27,I'm not joking.,شوخی نمی‌کنم,شوخی نمی‌کنم,شوخي نميکنم,شوخی نمی‌کنم,!شوخی نمی‌کنم,چراغت خراب شده - !شوخی نمی‌کنم -,.باید هرکاری میگی بکنم - .چراغت داره چشمک میزنه -,شوخي نميکنم,شوخي نميکنم,چراغ راهنمای شوخیت خاموشه - شوخی نمیکنم -,شوخي نميکنم
107:29,107:33,I'll need TARS to remove and adapt some components from KIPP.,"من به ""تارس"" نیاز دارم که چند قطعه مدار از ""کیپ"" برداره و به خودش نصب کنه","من به ""تارس"" نیاز دارم که چند قطعه مدار از ""کیپ"" برداره و به خودش نصب کنه",مي‌خوام تارس بعضي از بخش‌هاي کيپ رو جدا کنه و تطبيق بده,"من به ""تارس"" نیاز دارم که چند قطعه مدار از ""کیپ"" برداره و به خودش نصب کنه","""میخوام ""تارس"" چند قطعه از ""کیپ .جدا کنه و سازگار کنه",به تارس احتیاج دارم تا بعضی اجزاء رو از رو کیپ پاک و تعدیل کنم,"به ""تارس"" احتیاج دارم تا قطعاتی رو .از روی ""کِی.آی.پی.پی"" بردارم و تطبیقش بدم",مي‌خوام تارس بعضي از بخش‌هاي کيپ رو جدا کنه و تطبيق بده,تارس بايد بعضي از بخش هاي کيپ رو جدا کنه و تطبيق بده,"من ""تارس"" رو برای حذف و انطباق یه سری از اجزای ""کیپ"" لازم دارم",مي‌خوام تارس بعضي از بخش‌هاي کيپ رو جدا کنه و تطبيق بده
107:33,107:35,I don't want to disturb his archival functions.,خب، نمیخوام آسیبی به اطلاعات بایگانی‌اش وارد بشه,خب، نمیخوام آسیبی به اطلاعات بایگانی‌اش وارد بشه,خب، نميخوام عملکرد بايگاني اون رو بهم بزنم,"من به ""تارس"" نیاز دارم که چند قطعه مدار از ""کیپ"" برداره و به خودش نصب کنه",خب، من نمیخوام .کارهای مربوط به بایگانی‌ـش رو خراب کنم,خب، نمی‌خوام به عملکرد آرشیوی اون لطمه بزنم - خودم نظارت می‌کنم -,"به ""تارس"" احتیاج دارم تا قطعاتی رو .از روی ""کِی.آی.پی.پی"" بردارم و تطبیقش بدم",خب، نميخوام عملکرد بايگاني اون رو بهم بزنم,نميخوام توابع بايگاني شده اون رو بهم بزنه,نمیخوام توابع آرشیوی اش رو بهم بزنه,خب، نميخوام عملکرد بايگاني اون رو بهم بزنم
107:35,107:37,I'll supervise.,من نظارت میکنم,من نظارت میکنم,خودم کار رو سرپرستي ميکنم,خب، نمیخوام آسیبی به اطلاعات بایگانی‌اش وارد بشه,.من بهش رسیدگی می‌کنم,خب، نمی‌خوام به عملکرد آرشیوی اون لطمه بزنم - خودم نظارت می‌کنم -,".خُب, نمیخوام وظایف بایگانیش مختل بشه - .من نظارت میکنم -",خودم کار رو سرپرستي ميکنم,خودم رو  کارش نظارت ميکنم,خودم نظارت میکنم,خودم کار رو سرپرستي ميکنم
107:37,107:38,All right.,دکتر من، ما باید 3 منطقه امن پیدا کنیم,دکتر من، ما باید 3 منطقه امن پیدا کنیم,بسيار خب,من نظارت میکنم,".خیلی خب - .دکتر ""من""، باید سه جای امن پیدا کنیم -",خیلی‌خب,".خُب, نمیخوام وظایف بایگانیش مختل بشه - .من نظارت میکنم -",بسيار خب,خيلي خب,خیلی خب,بسيار خب
107:38,107:43,"Dr. Mann, we need to find three secure sites. One for Brand's lab, two for habitat.",یکی برای آزمایشگاه برند، 2تا برای زیستگاه,یکی برای آزمایشگاه برند، 2تا برای زیستگاه,دکتر مان، ما بايد 3 محل امن رو پيدا کنيم,دکتر من، ما باید 3 منطقه امن پیدا کنیم,"،""یک برای آزمایشگاه ""برند .دو برای سکونت",دکتر مان، باید سه جایگاه امن پیدا کنیم - یکی برای آزمایشگاه برند، دوتا هم برای محل سکونت -,".بسیار خب .دکتر ""من"", ما باید سه تا مکان ایمن پیدا کنیم",دکتر مان، ما بايد 3 محل امن رو پيدا کنيم,دکتر  مان مابايد 3محل امن رو پيدا کنيم يکي براي آزمايشگاه  برند،  و دو تا براي سکونت,"، دکتر مان"" ، ما 3 تا سایت امن نیاز داریم"" ""یکی برای آزمایشگاه ""برند و 2 جا هم برای زندگی",دکتر مان، ما بايد 3 محل امن رو پيدا کنيم
107:43,107:46,"Once those modules have landed, you don't want to move them.",،وقتی که اون ماژول‌ها فرود اومدن نباید جایی برین,،وقتی که اون ماژول‌ها فرود اومدن نباید جایی برین,وقتي اون ماژول‌ها فرود بيان ديگه نميشه تکونشون داد,،وقتی که اون ماژول‌ها فرود اومدن نباید جایی برین,،وقتی اون سفینه‌ها فرود بیان .دیگه نمیخوای جابجا بشی,وقتی ماژول‌ها فرود اومدن نباید تکونشون بدین [قسمتی از فضاپیما],",وقتی واحد های فضایی فرود اومدن .نمیخواد حرکتی بکنی",وقتي اون ماژول‌ها فرود بيان ديگه نميشه تکونشون داد,وقتي اون ماژول ها فرود بيان ديگه نميشه تکونشون داد,، نزدیک همون ماژول هایی باشه که خالی کردیم باور کن نمیخوای اونا رو تکون بدی,وقتي اون ماژول‌ها فرود بيان ديگه نميشه تکونشون داد
107:46,107:48,"I can take you to the probe sites, but I don't think...",خب، میتونم ببرمت به مناطقی که ...گردشگرها رفتن ولی فکر نکنم,خب، میتونم ببرمت به مناطقی که ...گردشگرها رفتن ولی فکر نکنم,خب، ميتونم تو رو به محل‌هاي کاوش‌شده ببرم ...اما فکر نميکنم اين,خب، میتونم ببرمت به مناطقی که ...گردشگرها رفتن ولی فکر نکنم,خب، می‌تونم ببرمت به جایی که کاوشگر ...قرار داره، ولی فکر نمی‌کنم این,خب می‌تونم ببرمتون به جایگاه کاوشگرها ...ولی فکر نمی‌کنم,",من میتونم به مواضع ماشین های اکتشافی ببرمت ...اما فکر نمی کنم این شرایط",خب، ميتونم تو رو به محل‌هاي کاوش‌شده ببرم ...اما فکر نميکنم اين,ميتونم تو رو به محل هاي کاوش شده ببرم ...اما فکر نميکنم اين,من محل کاوشگر رو بهتون پیشنهاد میکنم ولی بعید میدونم این شرایط بذاره فکر کنم باید صبر کنیم,خب، ميتونم تو رو به محل‌هاي کاوش‌شده ببرم ...اما فکر نميکنم اين
107:49,107:51,these conditions will hold. I think we should wait.,،فکر نکنم این شرایط پایدار بمونه بهتره صبر کنیم,،فکر نکنم این شرایط پایدار بمونه بهتره صبر کنیم,اين وضعيت ثابت باقي بمونه فکر کنم بهتره صبر کنيم,،فکر نکنم این شرایط پایدار بمونه بهتره صبر کنیم,.این شرایط باقی بمونن .فکر می‌کنم باید صبر کنیم,این شرایط باقی بمونه. فکر کنم بهتره صبر کنیم,.دوام داشته باشه .به نظر من بهتره صبر کنیم,اين وضعيت ثابت باقي بمونه فکر کنم بهتره صبر کنيم,اين وضعيت ثابت بمونه فکر ميکنم بهتره صبر کنيم,من محل کاوشگر رو بهتون پیشنهاد میکنم ولی بعید میدونم این شرایط بذاره فکر کنم باید صبر کنیم,اين وضعيت ثابت باقي بمونه فکر کنم بهتره صبر کنيم
107:51,107:54,COOPER: CASE is headed down with the rest of the distillery equipment.,"کیس"" چند دقیقه بعد با بقیه وسایل میاد اینجا""","کیس"" چند دقیقه بعد با بقیه وسایل میاد اینجا""",کيس داره با تجهيزات تقطير برمي‌گرده پايين,"کیس"" چند دقیقه بعد با بقیه وسایل میاد اینجا""","،کیس"" با تجهیزات تقطیر"" .داره به پایین برمی‌گرده",کیس با بقیه‌ی تجهیزات آزمایشگاهی داره میاد پایین,".کیس"" با بقیه اسباب و لوازم تقطیر برگشته""",کيس داره با تجهيزات تقطير برمي‌گرده پايين,کيس داره با تجهيزات تقطير برميگرده پايين,"کیس"" رو گذاشتیم که مراقب"" بقیه وسایل آزمایشگاه باشه",کيس داره با تجهيزات تقطير برمي‌گرده پايين
107:54,107:57,I'd really like to secure those sites by nightfall.,واقعاً میخوام اون مناطق رو تا قبل از شب بررسی کنم,واقعاً میخوام اون مناطق رو تا قبل از شب بررسی کنم,ميخوام قبل از شب حتما اون سايت‌ها رو ايمن کنم,واقعاً میخوام اون مناطق رو تا قبل از شب بررسی کنم,،واقعاً دلم میخواد تا شب .اون محل‌ها رو امن کرده باشم,دوست دارم اون جایگاهها رو تا شب امن کنیم,.مایلم تا شب این مواضع ایمن سازی بشه,ميخوام قبل از شب حتما اون سايت‌ها رو ايمن کنم,حتما ميخوام تا قبل از شب اون مکان هارو ايمن کنم,بهتره که سایت ها رو قبل از شب بنا کنیم,ميخوام قبل از شب حتما اون سايت‌ها رو ايمن کنم
107:59,108:02,"Well, these squalls do usually blow over.",خب، معمولاً طوفان‌های شدیدی ظاهر میشه,خب، معمولاً طوفان‌های شدیدی ظاهر میشه,خب، اين توفان‌ها معمولا زود تموم ميشن,خب، معمولاً طوفان‌های شدیدی ظاهر میشه,،خب .این بادها معمولاً اینجاها می‌وزن,خب، این توفان‌ها معمولاً زود فروکش می‌کنن,".خُب, این بادها معمولا تموم میشه",خب، اين توفان‌ها معمولا زود تموم ميشن,خب،اين بوران ها معمولا زود تموم ميشن,خب ، این طوفانها معمولا گذرا هستند,خب، اين توفان‌ها معمولا زود تموم ميشن
108:03,108:04,"Okay, then.",باید فرستنده‌ی دور بُرد داشته باشی - دارم -,باید فرستنده‌ی دور بُرد داشته باشی - دارم -,بسيار خب پس,خب، معمولاً طوفان‌های شدیدی ظاهر میشه,.پس خوبه - .باید یه فرستنده‌ی دوربُرد داشته باشی -,باشه پس,".خُب, این بادها معمولا تموم میشه",بسيار خب پس,خب، پس,خیلی خب پس,بسيار خب پس
108:04,108:06,- You'll need a long-range transmitter. - Got it.,باید فرستنده‌ی دور بُرد داشته باشی - دارم -,باید فرستنده‌ی دور بُرد داشته باشی - دارم -,ولي بايد يه فرستنده‌ي دوربرد داشته باشي - دارم -,باید فرستنده‌ی دور بُرد داشته باشی - دارم -,.پس خوبه - .باید یه فرستنده‌ی دوربُرد داشته باشی -,یه فرستنده‌ی دوربرد لازمت میشه - فهمیدم -,.خب پس - .تو باید فرستنده های دور بُرد رو انتخاب کنی,ولي بايد يه فرستنده‌ي دوربرد داشته باشي - دارم -,يه فرستنده ي دوربُرد احتياجت ميشه - دارم -,تو یه فرستنده دوربرد نیاز داری - دارمش -,ولي بايد يه فرستنده‌ي دوربرد داشته باشي - دارم -
108:06,108:08,- Are you charged? - Yeah.,همه چی شارژه؟ - بله -,همه چی شارژه؟ - بله -,شارژ شده؟ - آره -,همه چی شارژه؟ - بله -,.درسته - شارژ شدی؟ - .آره -,شارژ شدی؟ - آره -,.باشه - مسئولیتت رو گرفتی؟ - .آره -,شارژ شده؟ - آره -,شارژ شده؟ - آره -,شارژ داری ؟ - آره -,شارژ شده؟ - آره -
108:09,108:10,Follow me.,تارس، فقط 72 ساعت، خب؟ - اطاعت، کوپر -,تارس، فقط 72 ساعت، خب؟ - اطاعت، کوپر -,دنبالم بيا,همه چی شارژه؟ - بله -,"تارس"" 72ساعت، باشه؟"" - .""دریافت شد ""کوپر -",دنبالم بیا,.دنبام بیا,دنبالم بيا,دنبالم بيا,با من بیا,دنبالم بيا
108:10,108:13,"TARS, 72 hours, yeah?",تارس، فقط 72 ساعت، خب؟ - اطاعت، کوپر -,تارس، فقط 72 ساعت، خب؟ - اطاعت، کوپر -,تارس، 72 ساعت ديگه، خب؟,تارس، فقط 72 ساعت، خب؟ - اطاعت، کوپر -,"تارس"" 72ساعت، باشه؟"" - .""دریافت شد ""کوپر -",تارس، 72 ساعت، باشه؟ - دریافت شد، کوپر -,"تارس"" 72 ساعت درسته؟"" - ""مفهومه ""کوپر -",تارس، 72 ساعت ديگه، خب؟,تارس، 72 ساعت ديگه ،باشه؟,تارس ، 72 ساعت ، خب ؟,تارس، 72 ساعت ديگه، خب؟
108:13,108:14,"Roger that, Cooper.",تارس، فقط 72 ساعت، خب؟ - اطاعت، کوپر -,تارس، فقط 72 ساعت، خب؟ - اطاعت، کوپر -,دريافت شد، کوپر,تارس، فقط 72 ساعت، خب؟ - اطاعت، کوپر -,"تارس"" 72ساعت، باشه؟"" - .""دریافت شد ""کوپر -",تارس، 72 ساعت، باشه؟ - دریافت شد، کوپر -,"تارس"" 72 ساعت درسته؟"" - ""مفهومه ""کوپر -",دريافت شد، کوپر,دريافت شد،کوپر,"""دریافت شد ، ""کوپر",دريافت شد، کوپر
108:20,108:23,MANN: Brand told me why you feel you have to go back.,برند بهم گفت که چرا میخوای برگردی,برند بهم گفت که چرا میخوای برگردی,برند بهم گفت که چرا تو احساس ميکني که بايد برگردي,برند بهم گفت که چرا میخوای برگردی,"برند"" بهم گفت که چرا"" .احساس می‌کنی باید برگردی",برند بهم گفت که چرا احساس می‌کنی باید برگردی,".برند"" برام گفت چرا فکر میکنی باید برگردی""",برند بهم گفت که چرا تو احساس ميکني که بايد برگردي,برند بهم گفت که چرا احساس ميکني بايد برگردي,"برند"" بهم گفت برای چی حس میکنی باید برگردی""",برند بهم گفت که چرا تو احساس ميکني که بايد برگردي
108:25,108:28,But I'd be remiss if I didn't at least mention...,ولی کم لطفی کردم اگه اینو نگم ...که همچین ماموریتی,ولی کم لطفی کردم اگه اینو نگم ...که همچین ماموریتی,...اما وظيفه‌ي منه که حداقل اشاره کنم که,ولی کم لطفی کردم اگه اینو نگم ...که همچین ماموریتی,ولی بی‌مبالاتیِ من میشه اگه ...حداقل اینو نگم که یه مأموریت,ولی بی‌انصافیه اگه ...حداقل اشاره نمی‌کردم که یه ماموریت,غفلت بود اگه اشاره نمی کردم ...که ماموریت ما,...اما وظيفه‌ي منه که حداقل اشاره کنم که,اما من بايد آدم بي مبالاتي باشم ...که حداقل اشاره‌اي نکنم,... ولی حداقل باید اینو بهت یاد آوری کنم که,...اما وظيفه‌ي منه که حداقل اشاره کنم که
108:28,108:32,that a mission such as ours could certainly use an extra engineer.,قطعاً به مهندسین بیشتری نیاز خواهد داشت,قطعاً به مهندسین بیشتری نیاز خواهد داشت,ماموريتي مثل ماموريت ما مسلما نياز به يه مهندس اضافه داره,قطعاً به مهندسین بیشتری نیاز خواهد داشت,مثل مأموریت ما، قطعاً با یه .مهندس فوق‌العاده میتونه انجام بشه,مخصوصاً مثل ما بهتر بود با یه مهندس اضافی انجام بشه,.با یه مهندس اضافه هم میتونست عملی بشه,ماموريتي مثل ماموريت ما مسلما نياز به يه مهندس اضافه داره,ماموريتي مثل ماموريت ما حتما نياز به يه مهندس اضافه داره,حضور یه مهندس اضافی تو ماموریتی مثل این چقدر به کارمون میومد,ماموريتي مثل ماموريت ما مسلما نياز به يه مهندس اضافه داره
108:34,108:38,"You better slow down, turbo. Safety first, CASE, remember.",اولویت در امنیته، کیس، یادت نره,اولویت در امنیته، کیس، یادت نره,.آه، بهتره آروم بگيري، عجول ايمني در اولويته، کيس، فراموش نکن,بهتره آروم بری,".اول امنیت ""کیس""، یادت نره - .""اول امنیت ""کوپر -",بهتره آروم بری توربو اول امنیت، کیس، یادت باشه,".اول ایمنی ""کیس"", فراموش نکن - .اول ایمنی کوپر -",.آه، بهتره آروم بگيري، عجول ايمني در اولويته، کيس، فراموش نکن,بهتره آرومتر بگيري اول ايمني کيس،  يادت باشه,"بهتره یه ذره آرومش کنی ، بچه اول امنیت ، ""کیس"" ، یادت باشه",.آه، بهتره آروم بگيري، عجول ايمني در اولويته، کيس، فراموش نکن
108:39,108:41,"CASE: Safety first, Cooper.",اولویت در امنیت، کوپر,اولویت در امنیت، کوپر,ايمني در اولويته، کوپر,اولویت در امنیت، کوپر,".اول امنیت ""کیس""، یادت نره - .""اول امنیت ""کوپر -",اول امنیت، کوپر,".اول ایمنی ""کیس"", فراموش نکن - .اول ایمنی کوپر -",ايمني در اولويته، کوپر,اول ايمني ،کوپر,"""اول امنیت ، ""کوپر",ايمني در اولويته، کوپر
108:42,108:45,"COOPER: I have to tell you, Dr. Mann, I'm honored to be a part of this.",دکتر من، واقعاً باعث بسی افتخاره که منم جزئی از این شدم,دکتر من، واقعاً باعث بسی افتخاره که منم جزئی از این شدم,دکتر مان، بايد بگم که خيلي مفتخرم که بخشي از اين کار هستم,دکتر من، واقعاً باعث بسی افتخاره که منم جزئی از این شدم,"دکتر ""من"" باید بهتون بگم .باعث افتخارمه که عضوی از این کارم",باید بهتون بگم دکتر مان افتخار می‌کنم که سهمی در این کار داشته باشم,".دکتر ""مان"" باید به شما بگم باعث افتخاره که نقشی در این ماموریت دارم",دکتر مان، بايد بگم که خيلي مفتخرم که بخشي از اين کار هستم,دکتر مان،بايد بهتون بگم که خيلي افتخار ميکنم که بخشي از اين کار هستم,"، دکتر مان"" ، باید بهتون بگم که"" باعث افتخارمه که بخشی از این کار بودم",دکتر مان، بايد بگم که خيلي مفتخرم که بخشي از اين کار هستم
108:45,108:50,"But once we set up base camp and secure those modules, my work's done here.",،ماژول‌ها رو بررسی کردیم، کارم تمومه برمیگردم خونه,،ماژول‌ها رو بررسی کردیم، کارم تمومه برمیگردم خونه,اما وقتي که پايگاه اصلي رو راه انداختيم و اون ماژول‌ها رو جاگذاري کرديم، کار من در اينجا ديگه تمومه,...اما به محض اینکه کمپ‌ها رو ایجاد کردیم و,،و اون سفینه‌ها رو ایمن کردم .کارم اینجا تمومه. برمی‌گردم خونه,ولی به محض اینکه پایگاه رو سر پا کنیم و جای ماژول‌ها رو محکم کنیم کار من اینجا تمومه,".اون واحد های فضایی رو ایمن سازی کنیم, کار من اینجا تمومه .من میرم خونه",اما وقتي که پايگاه اصلي رو راه انداختيم و اون ماژول‌ها رو جاگذاري کرديم، کار من در اينجا ديگه تمومه,اما وقتي ما پايگاه اصلي روراه انداختيم و اون ماژول ها رو جايگزاري کرديم،کار من اينجا تمومه,ولی زمانی که کمپ اصلی رو بنا کنیم و ، ماژول ها رو هم ببندیم کار من اینجا تمومه ، من میرم خونه,اما وقتي که پايگاه اصلي رو راه انداختيم و اون ماژول‌ها رو جاگذاري کرديم، کار من در اينجا ديگه تمومه
108:51,108:52,I'm going home.,،ماژول‌ها رو بررسی کردیم، کارم تمومه برمیگردم خونه,،ماژول‌ها رو بررسی کردیم، کارم تمومه برمیگردم خونه,و ميرم خونه,،ماژول‌ها رو بررسی کردیم، کارم تمومه برمیگردم خونه,،و اون سفینه‌ها رو ایمن کردم .کارم اینجا تمومه. برمی‌گردم خونه,میرم خونه,".اون واحد های فضایی رو ایمن سازی کنیم, کار من اینجا تمومه .من میرم خونه",و ميرم خونه,من ميرم خونه,ولی زمانی که کمپ اصلی رو بنا کنیم و ، ماژول ها رو هم ببندیم کار من اینجا تمومه ، من میرم خونه,و ميرم خونه
108:54,108:56,(SPEAKING INDISTINCTLY),,,,,,,,,,,
109:00,109:04,You have attachments. But even without a family...,،اما حتی بدون خانواده هم، بهت قول میدم,،اما حتی بدون خانواده هم، بهت قول میدم,تو اونجا عزيزاني داري ...ولي من با اينکه خانواده‌اي ندارم,هممون وابسته‌ایم,،ولی حتی بدون خانواده ... می‌تونم بهت قول بدم که میل به,،یه وابستگی‌هایی داری ...ولی حتی بدون خانواده,حتی اگه خانواده ای هم در کار نباشه ...من میتونم قول بدم که اشتیاق,تو اونجا عزيزاني داري ...ولي من با اينکه خانواده‌اي ندارم,تو اونجا بستگاني داري ...ولي من با اينکه خانواده اي ندارم,شما وابستگی دارید ... ولی میتونم بهتون قول بدم,تو اونجا عزيزاني داري ...ولي من با اينکه خانواده‌اي ندارم
